id,name,username,description,location,profile_image_url,url,verified,followers_count,following_count,tweet_count,listed_count
15439395,Stephen Fry,stephenfry,Hello there .… this is Stephen. I don’t read Direct Messages I’m afraid. TROY available here https://t.co/l3c5kPjXja or as an audiobook,"Los Angeles, CA/ London UK",https://pbs.twimg.com/profile_images/842053173757984768/ZYLuzKYt_normal.jpg,,1,12632118,48722,24844,51761
18208354,Joe Rogan,joerogan,Stand up comic/mixed martial arts fanatic/psychedelic adventurer Host of The Joe Rogan Experience #FreakParty https://t.co/caBUmcvqBY,,https://pbs.twimg.com/profile_images/552307347851210752/vrXDcTFC_normal.jpeg,https://t.co/UoPqZeUr22,1,7045407,3865,45755,21169
5695632,BuzzFeed,BuzzFeed,"Brb, taking quizzes.",New York,https://pbs.twimg.com/profile_images/687767655214891008/n9pHVYUl_normal.png,https://t.co/iiAufe34NG,1,6449282,2892,265862,21153
15131310,Whole Foods Market,WholeFoods,"We’re the place to discover new flavors, new favorites and new ideas, whatever those might be. Tag your food obsession of the moment with #MakesMeWhole.","Austin, TX",https://pbs.twimg.com/profile_images/1037450039553978368/iuMg_L3Q_normal.jpg,https://t.co/85xEe2ZD2o,1,4319397,487308,259198,21083
49849732,Gustavo Petro,petrogustavo,Perfil Oficial del dirigente político progresista colombiano Gustavo Petro. Por una Colombia Humana con justicia social y en Paz,"ÜT: 4.650541,-74.074043",https://pbs.twimg.com/profile_images/962471262747529216/Uo8lOkRJ_normal.jpg,https://t.co/ho5XWkfwTr,1,4056222,2483,130948,4727
14055301,Save the Children US,SavetheChildren,Save the Children is an international humanitarian organization that has been protecting children around the world for more than 100 years. ❤️,"Fairfield, CT USA",https://pbs.twimg.com/profile_images/1215392034896244736/S__8tXpk_normal.jpg,https://t.co/PmmbfdZ0kd,1,2811299,4825,33410,9095
53297035,Kristen Bell,KristenBell,let's be friends.,"Los Angeles, California",https://pbs.twimg.com/profile_images/1307162966081634305/AxNusDgG_normal.jpg,,1,2740143,414,8646,14653
21774892,Mandy Moore,TheMandyMoore,"Singer-Songwriter-Actress on @NBCThisIsUs, Tuesdays 9/8c on @NBC 
New holiday songs out now!","Los Angeles, CA",https://pbs.twimg.com/profile_images/1087859697569263618/p-sO23R5_normal.jpg,https://t.co/tYmkvTl9FN,1,2388022,794,5855,14693
76351820,Louis Theroux,louistheroux,I am involved in the making of documentaries. Warning: Some tweets may contain irony.,London,https://pbs.twimg.com/profile_images/561352350263029761/swGNWK93_normal.jpeg,https://t.co/kSAkJDczWc,1,2230598,2350,3845,3470
33923443,MarQuis Trill • 11 Million Followers • The Goat 🐐,6BillionPeople,#1 Twitter Account For Most Following 📰Featured in Forbes • Ted Talks • NasdaQ | CEO/Creator of Model Agency @Modelfanscom | Cryptocurrency Blockchain Investor,"Los Angeles, CA",https://pbs.twimg.com/profile_images/1329482041713324033/Ufnn5hxP_normal.jpg,https://t.co/4Biv0dyJXC,1,2152289,4258101,181534,4149
77653794,Iván Duque 🇨🇴,IvanDuque,"Presidente de la República de Colombia 🇨🇴 2018-2022. Legalidad, Emprendimiento y Equidad. #ElFuturoEsDeTodos",,https://pbs.twimg.com/profile_images/1354213416819445763/yth8HIxq_normal.jpg,https://t.co/4izGiG5D2C,1,2148930,1782,30178,2108
17004618,Nicholas Kristof,NickKristof,"Oregon farmboy turned NY Times columnist, author with my wife, @WuDunn, of Tightrope & Half the Sky. I'm on IG at @NickKristof and FB at https://t.co/Rbcd4lbWBD",Everywhere,https://pbs.twimg.com/profile_images/680936862387589120/DfkrlW27_normal.jpg,https://t.co/CO7uxBqpWU,1,2052189,2820,48077,22102
51200175,fernando paulsen,fernandopaulsen,Periodista (journalist),"Santiago, Chile",https://pbs.twimg.com/profile_images/1325883528962330624/XKSvq2iK_normal.jpg,,0,1705914,1152,29339,5503
18980276,Tim Minchin,timminchin,"Upright (TV Show out now)
Apart Together (Album out now)
Matilda & Groundhog Day (Musicals)
Atticus Fetch. Judas. Friar Tuck.
Pianist
Comedian
Words³",,https://pbs.twimg.com/profile_images/1293830663460749313/hvSL5b2h_normal.jpg,http://t.co/uIQCcm1FFh,1,1500371,511,15973,7372
4265721,León Krauze,LeonKrauze,"📺 @Univision 🖊 @WashingtonPost @El_Universal_Mx @Letras_Libres 📰 @NewYorker @Atavistmag @Slate 🎙@HistoriasPer  Opinions are mine, not @univision’s.","Los Angeles, CA",https://pbs.twimg.com/profile_images/921107324562939904/XOUzegYz_normal.jpg,https://t.co/GCDBVoD8Ee,1,1498684,19338,147113,7090
116994659,Sam Harris,SamHarrisOrg,"Author of The End of Faith, FreeWill, and other bestselling books; host of the Making Sense podcast; and creator of the Waking Up app (@wakingup).",,https://pbs.twimg.com/profile_images/1258982988781506561/hz5gbQYa_normal.jpg,https://t.co/Wc8q0FHn8A,1,1463671,535,9464,11077
15458694,HuffPost Politics,HuffPostPol,"The latest political news from HuffPost's politics team.

Need help with HuffPost login or membership? Tweet @HuffPostSupport","Washington, D.C.",https://pbs.twimg.com/profile_images/1191112430367256579/YLiH4MlA_normal.jpg,https://t.co/tn6MKaH6mv,1,1457147,8686,317638,16554
26548315,Soledad O'Brien,soledadobrien,working mom,New York,https://pbs.twimg.com/profile_images/1317585860481736704/2UG16TCA_normal.jpg,https://t.co/bpjy55iFNE,1,1344995,438139,104445,10684
28644174,B.J. Novak,bjnovak,,,https://pbs.twimg.com/profile_images/1190173758696374274/0Y2GgbLi_normal.jpg,https://t.co/TmGy76Rwqm,1,1326065,902,8411,4651
1947301,The Nation,thenation,The place for debate on the left. Subscribe: https://t.co/3ZHgm1UYYK,,https://pbs.twimg.com/profile_images/1308165490293051393/VDo09b2K_normal.png,http://t.co/PpzoTPS9,1,1281771,8955,98700,14629
37836873,Lil B THE BASEDGOD,LILBTHEBASEDGOD,"Mogul, First Rapper Ever To Write And Publish A Book at 19, Film Score, Composer, Producer,Director/Photo/Branding/Marketing/Historical Online Figure #BASED",United States,https://pbs.twimg.com/profile_images/1248509273/39198_1571854573776_1157872547_31663366_5779158_n_normal.jpg,https://t.co/zoy27sPkw9,1,1278248,1449532,249198,5194
14464766,moby XⓋX,thelittleidiot,bald alien. adopted son of john waters. lover of alf & the a.l.f. #animalrights #littlepine #impeachtrump . #vegan since 1987,l.a,https://pbs.twimg.com/profile_images/1217112471359623168/dlshpuHs_normal.jpg,https://t.co/REFctdedKD,1,1160784,1996,15954,10097
14327149,Rivers Cuomo,RiversCuomo,Riverchat is the new myspace.,,https://pbs.twimg.com/profile_images/1271929014576312320/42xVyYJF_normal.jpg,https://t.co/Ue38cpdGpT,1,1158162,2452,561,6288
35206553,Megan Amram,meganamram,"it's this weird, sexual, anti-comedy comedy that's 'in' right now. - my mom","Los Angeles, CA",https://pbs.twimg.com/profile_images/890366092/n31883_33925212_8870_normal.jpg,https://t.co/AOEekHnf6F,0,1144475,4309,12946,8559
288452305,AlecBaldwin(HABF),AlecBaldwin,"Hilaria and Alec Baldwin Foundation. Supporting the arts + artists, amateur + professional. https://t.co/joORCCHv8g","New York, NY",https://pbs.twimg.com/profile_images/1347934403960434690/oNIyNpQ3_normal.jpg,https://t.co/MT9Cx6ogcu,1,1058171,2038,28895,8417
46696817,HarperCollins,HarperCollins,Publishing great authors since 1817. Say hello@harpercollins.com.,"195 Broadway, New York",https://pbs.twimg.com/profile_images/1352693813387653121/Zi2LN-RG_normal.jpg,https://t.co/H9CqQSo6A3,1,1018362,3528,68892,5068
41814169,Fareed Zakaria,FareedZakaria,"WaPo columnist. Host of CNN's GPS, Sundays @ 10am and 1pm ET in the US. Order my new book, ""Ten Lessons for a Post-Pandemic World"" https://t.co/MwV6OgL9mj","New York, NY",https://pbs.twimg.com/profile_images/1113110574039252992/vc0VBYEg_normal.png,http://t.co/Mg215EOokH,1,1000202,434,9405,10981
361274334,Rabindra Mishra,RabindraMishra,"President, Bibeksheel Sajha Party. Former Head, @BBCNepali. Founder, https://t.co/JePhvrGu5x. Essayist & Poet. FB: https://t.co/9jFzocoHbe",Nepal,https://pbs.twimg.com/profile_images/1337772485702402050/QKt3EKcY_normal.jpg,https://t.co/5mTI1R5yHm,0,996973,499,16686,304
36843988,TED News,TEDNews,News from #TED and its global community of passionate thinkers. Follow @TEDTalks for daily talks and ideas.,"New York, NY",https://pbs.twimg.com/profile_images/3279174286/5de7d7794205fc0ba09bdf54e6c16707_normal.png,http://t.co/GpbDBvz7y1,1,933311,16791,13098,14150
11695472,Oxfam International,Oxfam,Oxfam is a world-wide development organization that mobilizes the power of people against poverty. See also: https://t.co/D8VfP9Jvuw,,https://pbs.twimg.com/profile_images/1298206966603554817/exbtqg2z_normal.jpg,https://t.co/RJrpCzdIL9,1,846252,1230,51418,10661
90570778,Zach Boychuk,ZachBoychuk,Subscribe to my YouTube 📺 Snapchat👻 & İnstagram 📷 Username: ZachBoychuk,,https://pbs.twimg.com/profile_images/875864167902621697/pEUv372v_normal.jpg,https://t.co/VMYEaErsmC,1,830279,556250,5162,2002
16294264,Perfil.com,perfilcom,"Noticias desde Buenos Aires, Argentina. Periodismo puro en tiempo real.",Argentina,https://pbs.twimg.com/profile_images/1164964173173919745/glzWtfes_normal.png,http://t.co/BcW9F9qdOU,1,815217,3214,279675,3988
21114659,Foreign Affairs,ForeignAffairs,"A magazine of U.S. foreign policy and international affairs since 1922.

Sign up for our newsletters: https://t.co/LuDofzH1Gu","New York, NY",https://pbs.twimg.com/profile_images/472450440747962369/mUbM-DPs_normal.jpeg,https://t.co/83wqGhaXRu,1,796512,2009,73874,12744
17467699,@nonprofitorgs / Nonprofit Tech for Good,nonprofitorgs,"Promotes ORGs doing great work in the world & shares useful technology resources. Only follows NPOs, NGOs, charities & activists. Based in Tucson, AZ. 🌵",Worldwide,https://pbs.twimg.com/profile_images/778396864617914368/ExyF8M_F_normal.jpg,https://t.co/TnpCTruJyj,1,790877,355538,28211,9875
14879097,SEGA L'éveilleur®🚨,segalink,"Life, Leadership and Legacy encapsulated in Love. ‘Segun Awosanya® CEO @AliensmediaComm Founder @SIAF_ng Convener #EndSARS #BM @IPSPRorg #RP #RiseAsOne",SEGATRON HQ LOS ABV NGR UAE FR,https://pbs.twimg.com/profile_images/1209488185144811523/5ESaogp2_normal.jpg,https://t.co/JifUaB2TpW,0,768342,29140,402196,683
2553151,Avaaz,Avaaz,"A global civic movement connecting over 60 million citizens worldwide, bringing people-powered politics to decision-making everywhere. Press: @Avaaz_News",Worldwide,https://pbs.twimg.com/profile_images/1135904263761059841/GCH9aR0B_normal.png,https://t.co/93GIknkhUP,1,755593,9978,9042,6106
26250653,TheRealSleepSkee,SleepSkee,"Independent Recording Artist. || NEW Single #Major Now Streaming EVERYWHERE!!
 #HitTheLinkInTheBio",PITTSBURGH,https://pbs.twimg.com/profile_images/1345116351124353026/vB3x2_Hx_normal.jpg,https://t.co/qxUKQJaHBr,1,749172,789969,41479,2281
15014405,Pleasure Ellis™️,PleasureEllis,𝗘𝗻𝘁𝗲𝗿𝘁𝗮𝗶𝗻𝗲𝗿 👨🏾‍🎤 | 𝗧𝗿𝗮𝗻𝘀𝗳𝗼𝗿𝗺𝗮𝘁𝗶𝗼𝗻 𝗔𝗿𝘁𝗶𝘀𝘁🕺🏽 | 𝗖𝗲𝗹𝗲𝗯𝗿𝗶𝘁𝘆 𝗜𝗻𝗻𝗲𝗿 𝗪𝗼𝗿𝗹𝗱 𝗘𝘅𝗽𝗲𝗿𝘁 👨🏾‍💼,Everywhere Transforming Lives,https://pbs.twimg.com/profile_images/1102460256242720768/0mtV8uRk_normal.jpg,https://t.co/p5pvE8PhJB,1,718835,415491,176870,13975
24889586,Anand Giridharadas,AnandWrites,"Publisher of https://t.co/mAxIDJ5Fat. SUBSCRIBE! Author: @WinnersTakeAll, THE TRUE AMERICAN, INDIA CALLING. Also MSNBC and TIME. @PriyaParker's man. Dad. Tweets vanish.",New York,https://pbs.twimg.com/profile_images/1305938381382316034/HYM4tc5X_normal.jpg,https://t.co/mqbW5u0U7H,1,715615,9160,226,3949
10505322,Rhett McLaughlin,rhettmc,Co-founder of @mythical. Lover of beans.,Los Angeles,https://pbs.twimg.com/profile_images/1344328180161605633/IrHNHLhM_normal.jpg,https://t.co/Uzk5nDEtDn,1,686288,741,4967,1583
64496398,Melissa Joan Hart,MelissaJoanHart,"You may know me as Clarissa or Sabrina or Mel from Melissa& Joey, but my 3 boys Mason, Brady & Tucker call me Mommy! Thats my favorite role yet!","Bedford Falls, USA",https://pbs.twimg.com/profile_images/1265174718597828608/4Ej8FM_U_normal.jpg,,1,658468,162681,27997,4970
84282385,Hugo Clément,hugoclement,#SurLeFront Contact pro : contacthugoclement@gmail.com,,https://pbs.twimg.com/profile_images/1142073276212142081/2me4yGzB_normal.jpg,,1,651989,945,2058,1238
210684204,Taye Diggs,TayeDiggs,I'm serious chocolate and don't get it twisted. https://t.co/AjINiSHMHu @CWAllAmerican All American Host @CriticsChoice,"Los Angeles, CA",https://pbs.twimg.com/profile_images/895366991095058432/ifViMdPy_normal.jpg,,1,648359,687673,30062,3619
219508242,Héctor Abad F.,hectorabadf,Escritor. Columnista de El Espectador. Editor.,"Medellín, Colombia",https://pbs.twimg.com/profile_images/1176024396/Cairo_Ana_normal.jpg,https://t.co/UW7o54Mb8h,0,644924,2372,9188,0
71699343,Jorge Pontual,JorgePontual,,New York City,https://pbs.twimg.com/profile_images/1256763484018270209/AK8p9QMh_normal.jpg,https://t.co/Rf0qUKYmDA,1,630316,5522,38059,1757
27013292,The Lancet,TheLancet,"Welcome to The Lancet on Twitter. Keep in touch with The Lancet, one of the world's leading general medical journals, published weekly since 1823 #FutureChild","London, New York, Beijing",https://pbs.twimg.com/profile_images/378800000725668351/16bf102fc319d621a456d9f821071253_normal.jpeg,https://t.co/SXqBMKuLCJ,1,625259,289,17504,8182
87266285,Hollman Morris 🚇🌳👩🏽‍🎓,HOLLMANMORRIS,"Líder progresista. Exconcejal de Bogotá Mov. Progresista. Defensor DDHH, Periodista Becario Nieman @Harvard ex Director @Contravia y Canal Capital en Btá Humana","Bogotá, D.C., Colombia",https://pbs.twimg.com/profile_images/1308013303579500545/9zRCQglY_normal.jpg,https://t.co/CPtO4GblQW,1,595947,1745,91000,1806
24223641,Michael Pollan,michaelpollan,Author of How to Change Your Mind; Cooked; Food Rules; In Defense of Food; The Omnivore’s Dilemma; The Botany of Desire and Second Nature.,"Berkeley, CA",https://pbs.twimg.com/profile_images/2992761845/bc2f1ddf99da4c777b98768be883078e_normal.jpeg,http://t.co/kzPOTQDuTu,1,561737,681,10528,11282
102600381,Emily Deschanel,emilydeschanel,Well....I am pretty fancy.,,https://pbs.twimg.com/profile_images/1793368388/emilydeschanel_profile_normal.jpg,,1,545814,279,1571,3046
554510636,shitty watercolour,SWatercolour,i make wet art shitty@shittywatercolour.com,Cambridge UK,https://pbs.twimg.com/profile_images/1126154136754499586/-W_CASZZ_normal.jpg,https://t.co/zmLGzD0Crk,1,545397,2586,14514,1658
21075591,Annabel Crabb,annabelcrabb,"ABC political writer and commentator, author The Wife Drought, bickers with @leighsales on @Chat10Looks3, new Quarterly Essay ""Men At Work"" out now, see link:",Australia,https://pbs.twimg.com/profile_images/87421442/boatrace2_normal.jpg,https://t.co/E0GrkybljS,1,505072,2536,29057,3055
7383122,UNICEF USA,UNICEFUSA,"We do whatever it takes to save and protect the world's most vulnerable children.

Follow us for updates on how UNICEF keeps families safe from #COVID19.","New York, NY",https://pbs.twimg.com/profile_images/843821060462166016/hKmmReZL_normal.jpg,http://t.co/W4VlVWz8Ea,1,504976,7077,34018,3335
7.44E+17,DJ KING ASSASSIN,djkingassassin,DJ Producer for #2Pac #IceT #RobBase #Cold187 #Kokane #MikeJones #Club #SeanCole #Treach #EazyE #Roger #4Tay #Wyclef #ShockG #MCHammer #HouseOfMarley #CoreDjs,Syndicated World Wide,https://pbs.twimg.com/profile_images/1344879233504407552/EHReVd39_normal.jpg,https://t.co/ePD5xsgqOo,1,499394,1436705,137176,778
7429102,Mark Warner,MarkWarner,"U.S. Senator from Virginia. Chairman, Senate Intel Committee.",Virginia,https://pbs.twimg.com/profile_images/1297269999476842496/vv1jXjJg_normal.jpg,https://t.co/sIM9jRW0rP,1,488054,24728,10822,4825
118241069,Eri Fernandez,ERIFERCA,CONDUCTORA EN @foxsportsmx FELIZMENTE TATUADA Y EMPLEADA fundadora de @amorsinraza #lovehard,colombia/usa/mexico,https://pbs.twimg.com/profile_images/1354534591932018690/Mb2qHqoD_normal.jpg,,1,481275,4097,22643,518
5252591,Bill Gurley,bgurley,"VC @benchmark, Investor: @grubhub, @zillow, @uber, @stitchfix, @nextdoor, @glassdoor, @hacker0x01, @solvhealth, @roverdotcom, @goodeggs, @instawork",Silicon Valley,https://pbs.twimg.com/profile_images/1338587084911767554/Le6JNY5F_normal.jpg,https://t.co/k5pH0oGDTr,1,470678,1209,9998,5941
7.14E+17,Democratic Coalition,TheDemCoalition,We helped run #TheResistance against Trump and established the #ImpeachmentTaskForce. We campaign for Dems and have an aggressive online organizing program.,"Washington, DC",https://pbs.twimg.com/profile_images/837403510111105025/RaRX8t9n_normal.jpg,https://t.co/81I6JTLpUG,1,461029,27737,185642,2070
19826509,Open Culture,openculture,We make the web a more intelligent place. A Thought-Provoking Blog. Free Courses. Free Audio Books & eBooks. And more.,Planet Claire,https://pbs.twimg.com/profile_images/851645340830715904/jrs1gcNM_normal.jpg,http://t.co/HVA1Vpy2Ba,0,445451,1000,81962,12405
5694822,Princeton University,Princeton,The official Twitter account of Princeton University. Use #PrincetonU to join the conversation.,"Princeton, NJ",https://pbs.twimg.com/profile_images/1323967325750611968/LRqfVSNv_normal.jpg,https://t.co/c3nTglNSOW,1,425377,1564,38968,3670
27938182,Natalie Wynn,ContraPoints,"YouTuber, ex-philosopher.
E-mail: info@contrapoints.com",,https://pbs.twimg.com/profile_images/1303044453544976394/U4N_fNXn_normal.jpg,https://t.co/shk6RdD98E,1,416995,1406,5188,1043
39335597,PETA Deutschland,PETADeutschland,"Tierquälerei stoppen.
Tierrechte etablieren.
Mitgefühl für Tiere stärken.

Impressum:
PETA Deutschland e.V.
Friolzheimer Str. 3
70499 Stuttgart
info@peta.de",Stuttgart,https://pbs.twimg.com/profile_images/1324000507900399618/n96DDQLK_normal.jpg,https://t.co/5fbcgNAYtE,1,409960,7242,33801,620
198584761,George Monbiot,GeorgeMonbiot,"“I love not man the less, but Nature more.”",,https://pbs.twimg.com/profile_images/3594607450/ff6fbd42964f9a0def79d8acbfa034bd_normal.jpeg,http://t.co/DWv0C2B9q5,0,397575,2053,41133,5364
14266598,350 dot org,350,We're an international movement of ordinary people working to end the age of fossil fuels and build a world of community-led renewable energy for all.,Everywhere,https://pbs.twimg.com/profile_images/1275185540325756929/UB8fIMLf_normal.jpg,https://t.co/PvZxwygbQd,1,392605,19758,53997,7395
16213404,QandA,QandA,"#QandA is a chance to ask questions, challenge power and share your views. We tweet other people’s opinions to inspire questions, not express our own views.",Australia,https://pbs.twimg.com/profile_images/1229958655174332417/pySVwdFK_normal.jpg,https://t.co/oH6c5AqK3l,1,386628,1059,39567,2127
99943864,C. Mervyn Graham ™®,Daminous_Purity,#Minister #Actor #Entertainer #PublicFigure #YouTuber #YouTube #WWE #NFL #FIFA #UFC #MM #PL #EPL #Football #Soccer #LFC https://t.co/Mg3MHQi2Vt,Great Britain and Ireland,https://pbs.twimg.com/profile_images/1353461097932713985/2mnpYQkl_normal.jpg,https://t.co/uhUsOWgC1S,0,372550,402245,709485,672
20690398,Duncan Jones,ManMadeMoon,"Director of Moon, Source Code, Warcraft, Mute & soon ROGUE TROOPER!",,https://pbs.twimg.com/profile_images/1344744333/duncan8bit_normal.jpg,https://t.co/AIZINeWaqO,1,368735,1180,152005,3626
1059273780,Adam Grant,AdamMGrant,"Organizational psychologist @Wharton. Books: THINK AGAIN, GIVE AND TAKE, ORIGINALS. Podcast: WorkLife @TEDTalks. Diver. Success is helping others succeed.","Philadelphia, USA",https://pbs.twimg.com/profile_images/1169919000123518978/37QQ8Una_normal.jpg,https://t.co/OEBqDra8tq,1,361853,980,4099,5531
2163374389,Existential Comics,existentialcoms,A philosophy webcomic about the inevitable anguish of living a brief life in an absurd world. Also jokes. https://t.co/ngRN9krOEu,"Portland, OR",https://pbs.twimg.com/profile_images/792916557403795456/d-iEnfPD_normal.jpg,http://t.co/2YD0UU9vYY,0,354028,150,8238,2715
9273802,Scott Galloway,profgalloway,Product of big government @ucla @ucberkeley | Prof Marketing @NYUStern | Right of Center-Left| Strategy Sprint https://t.co/57CtTLBpoc,NYC,https://pbs.twimg.com/profile_images/1331218879293612034/m3uvNtD0_normal.jpg,https://t.co/7p9Sm7nKpx,1,349198,1206,28219,4988
11695602,OxfamAmerica,OxfamAmerica,Oxfam is a global organization working together to end the injustice of poverty. See our work in action on Instagram: @OxfamAmerica,"Boston, MA",https://pbs.twimg.com/profile_images/1325175413379788800/veS4m5g8_normal.png,https://t.co/Ckxl9pcYIV,1,341111,10954,29098,3559
4432431,Rotary International,Rotary,"Rotary unites more than a million great minds around a shared purpose. And together, there's no limit to the good we can do. #peopleofaction","Evanston, IL USA",https://pbs.twimg.com/profile_images/1039943443169124353/yquNJBLW_normal.jpg,https://t.co/RItLkdE8F0,1,336238,9298,26825,2839
19570960,Donald J. Trump ........................... ᵖᵃʳᵒᵈʸ,realDonaldTrFan,45th Parody of the United States of America 🇺🇸. Don’t forget to turn on notifications for this Parody account. More at “https://t.co/FRIL8ACx7D,You can help support at:,https://pbs.twimg.com/profile_images/812182136354697216/62tPgP5a_normal.jpg,https://t.co/QrZSPhMDrz,0,330856,246737,2125,912
18064626,Big Cat Rescue,BigCatRescue,"Providing permanent home to many lions, tigers & wild cats. Ending the breeding, trade, use and abuse w/ better laws at https://t.co/6lb3kQHEwc","12802 Easy St Tampa, FL 33625",https://pbs.twimg.com/profile_images/771835005370822661/xaVXBa6T_normal.jpg,https://t.co/GQWPQv5rxQ,0,326697,4939,45128,899
2709644533,Ahmed Elghandour,Da7eee7,"First Popular Science channel in the Arab World ! 
الدحيح للعلوم والفلسفة عشان محدش ياخد عالأفة..

https://t.co/wKBm4TfMh3",,https://pbs.twimg.com/profile_images/502392060075200513/IsOyTeQJ_normal.jpeg,,1,326260,761,708,109
110855776,Socceroos,Socceroos,"Official account of Australia’s Men’s National Football Team, the @Socceroos. #AllForTheSocceroos",Australia,https://pbs.twimg.com/profile_images/1339322570739355649/hHR5q2ok_normal.jpg,https://t.co/ajvuEvIc2i,1,309625,22696,41673,1678
21217815,Georgina Verbaan,GVerbaan,📺 #TheBloodPact #Klem3 🎬#buitenishetfeest 📕📓#LozeRuimte #IetsOmNaarUitTeKijken,Op zolder,https://pbs.twimg.com/profile_images/1342223248965201920/43y5kA3G_normal.jpg,,1,302243,2177,55060,1182
76133133,Nacho Goano,nachogoano,Periodista Deportivo/ Conductor/ #HoyNosToca @CanalciudadBA #CronicaCentral @CronicaTv  https://t.co/teOmQ6YCkJ,"Buenos Aires, Argentina",https://pbs.twimg.com/profile_images/588293323850407937/cImYWyhI_normal.jpg,,0,300207,93384,125659,1807
33787936,Mercy For Animals,MercyForAnimals,Mercy For Animals exists to end one of the greatest causes of suffering on the planet: the exploitation of animals for food. 🐮🐷🐔🐟,"Los Angeles, CA",https://pbs.twimg.com/profile_images/1280548387608092672/phLL3gpm_normal.jpg,https://t.co/Wopqf5SACP,1,296034,1568,70456,1753
23967554,Partners In Health,PIH,"A social justice & global health organization striving to make health care a human right for all people, starting with those who need it most #InjusticeHasACure",,https://pbs.twimg.com/profile_images/588073898018648064/6RFQt3Q__normal.png,http://t.co/a8NY27cDal,1,281506,929,17507,3806
21611239,Sean Carroll,seanmcarroll,"Physicist, @Caltech & @SFIscience. Host, #MindscapePodcast. Married to @JenLucPiquant. Biggest Ideas in the Universe videos: https://t.co/LSMB4If2Jn. He/him.",Los Angeles,https://pbs.twimg.com/profile_images/1080212821831372800/kuD8Y01v_normal.jpg,https://t.co/ibcrloCWhS,1,277646,427,21554,3302
65770439,Jason Isaacs,jasonsfolly,Professional faker. Amateur human. Failed deatheater. Tightly-clad space pilot. Commie. Angel Hunter. Don't even. https://t.co/mWgfcgo5Cz,Lost,https://pbs.twimg.com/profile_images/991363134416826368/Mo8p3jCP_normal.jpg,,1,275646,134,3458,1303
9543462,สฤณี อาชวานันทกุล,Fringer,"Building bridges, with words | สร้างสะพานผ่านตัวหนังสือ https://t.co/uHDEGYnPh8",Bangkok,https://pbs.twimg.com/profile_images/762796460777754624/yaZXoIl7_normal.jpg,https://t.co/ufpJE8gYsH,0,268247,4687,80785,481
69021389,Dr. Aminu Gamawa,aminugamawa,"Commissioner, Budget and Economic Planning, Bauchi State. (@BauchiPlanningC )
Opinions are mine.","Bauchi, Nigeria",https://pbs.twimg.com/profile_images/1200521078633828357/7_MaGEUi_normal.jpg,https://t.co/bY0suK1oje,1,264954,5369,27535,164
33519870,CJ Werleman,cjwerleman,Global Correspondent for Byline Times. Columnist for Inside Arabia. Activist against Islamophobia. Plz support: https://t.co/tnDXsIhkhO,USA,https://pbs.twimg.com/profile_images/1291156811555299328/Gz41ljPh_normal.jpg,https://t.co/mdDkbSV83f,1,262051,3345,61125,2492
106204123,Jonathan Haidt,JonHaidt,"Social psychologist at NYU-Stern. I study moral and political psychology, and business ethics",New York City,https://pbs.twimg.com/profile_images/1016270335690330112/RlqHFIoi_normal.jpg,http://t.co/Qb2UMLsyhd,1,256819,1300,2550,3451
289548939,Bari Weiss,bariweiss,"Writing on Substack. Former @nytimes, @WSJ, @tabletmag. Head of @nelliebowles fan club.",,https://pbs.twimg.com/profile_images/1087390881361981440/ZXvGu7MR_normal.jpg,https://t.co/ZDf3OQTVMw,1,254953,3035,9130,1926
33323849,Vegan,vegan,"The https://t.co/uylXXXbBpu Twitter feed. 🥦
Copyright Mocana Productions, Inc.",,https://pbs.twimg.com/profile_images/468574382055362560/xqHkMuLD_normal.png,http://t.co/3a3bHyE0Yd,0,254426,389,28290,2106
14647281,Mélissa Bounoua,misspress,🔈cofondatrice du studio de podcasts @louiemedia | ex red-cheffe adj Slate | 📷 Insta : @misspress | au CA de @prenonsla1,Paris,https://pbs.twimg.com/profile_images/1135123135081172992/63ul8tff_normal.jpg,https://t.co/vHKZjNy0vs,1,253913,3205,23832,2355
