id,name,username,description,location,profile_image_url,url,verified,followers_count,following_count,tweet_count,listed_count
21291921,"have fun, jmo",hfjm,"Informé par la recherche;
Poussé par des objectifs d'affaires

Recherche, conception et formation des clients pour vous aider à comprendre,
interagir et mieux c",,https://pbs.twimg.com/profile_images/954097134676185088/MCAwyiyC_normal.jpg,,0,12205,13908,18480,396
35507163,Caro Torreblanca,caro_whitetower,Las Bios son un instrumento del heteropatriarcado || estudiando un doctorado en @NYUpolitics ||,,https://pbs.twimg.com/profile_images/1346993867661344768/N-TrNy7h_normal.jpg,,0,12203,1910,10511,69
19188956,Geraldina González de la Vega,Geraldina_GV,"Presidenta del Consejo para Prevenir y Eliminar la Discriminación de la Ciudad de México, @COPRED_CDMX | I want to be the one that walks in the sun | Feminista",Ciudad de México,https://pbs.twimg.com/profile_images/1334668128937242627/eNfTDRQq_normal.jpg,https://t.co/jRoEKCZ034,0,12192,3992,88448,263
91535157,Free Tony The Tiger,FreeTonyTiger,We mourn the loss of our beloved tiger friend Tony & will continue to fight for captive tigers in his honor. #FreeTonyTiger,,https://pbs.twimg.com/profile_images/1074618456539103232/MM6BZoSN_normal.jpg,https://t.co/dCndQr98TF,0,12191,3660,41408,248
264659393,「おいしい昆虫記」発売！蟲喰ロトワ(むしくろとわ)@ラオスから緊急帰国中,Mushi_Kurotowa,"Entomophagist, Entomologist. My goal is to have insects treated as a normal food culture in the world. I have tasted 419 species of insects since 2008.",書籍出ます！https://amzn.to/3hiIMde,https://pbs.twimg.com/profile_images/1248852084184604672/87wgtQue_normal.jpg,https://t.co/pJFI4D08cf,0,12184,4980,156070,344
26049108,Camille Labchuk,CamilleLabchuk,"Animal lawyer & executive director of @AnimalJustice. Co-host of the Paw & Order podcast. Civil libertarian. I tweet about animals, law, food, politics.",Toronto,https://pbs.twimg.com/profile_images/1215368046207913984/RgVGQrJh_normal.jpg,https://t.co/uvYbDsHhoR,0,12184,3265,30028,326
26786964,John O'Farrell,johnofa,"General Partner, a16z. All opinions my own.",Silicon Valley,https://pbs.twimg.com/profile_images/1639313949/ofarrell_john_abosch_normal.jpg,,0,12183,407,4958,337
61424230,John Dickson,johnpauldickson,"Think Write Speak (occasionally Sing)—Host of https://t.co/WB0LEmmTlS podcast—PhD Ancient History—Distinguished Fellow, Ridley College—Sympathetic to people's doubts.",Sydney,https://pbs.twimg.com/profile_images/1195914268085895169/QEU-_30g_normal.jpg,https://t.co/EJPb33JZGb,1,12179,2400,13794,243
25115454,Princeton School of Public & International Affairs,PrincetonSPIA,We are dedicated to integrating world-class scholarship and a commitment to service in order to make a positive difference in the world. 🌍,"Princeton, NJ, USA",https://pbs.twimg.com/profile_images/1178754233358831617/Xgw9wqrQ_normal.jpg,https://t.co/vczl008pAO,0,12165,1149,10649,361
2745835322,Animal Cognition,animalcog,Help us report on investigations of the mental capacities of animals! https://t.co/7CCCV8goBy,,https://pbs.twimg.com/profile_images/574995919378063360/tWkNDOTF_normal.jpeg,https://t.co/R8jIFpiQfC,0,12164,1572,1568,190
1047019220,Direct Action Everywhere,DxEverywhere,"Using investigation, mobilization, nonviolent direct action, & community to create revolutionary social & political change for animals. Inquiries:press@dxe.io","Berkeley, CA",https://pbs.twimg.com/profile_images/1286875059953364992/j1Mc48Xu_normal.jpg,https://t.co/8x0JLrw7yb,0,12144,2755,11458,141
204736152,Vegetarian Butcher,Vegebutcher,World's first Vegetarian Butcher: hacking your meat favourites with true Butcher's craftmanship 👩‍🌾 Join the biggest Food Revolution #thevegetarianbutcher,The Hague,https://pbs.twimg.com/profile_images/815862410603008000/7IA4eNla_normal.jpg,https://t.co/ABcnLLJl3L,0,12138,12761,25058,380
16923632,Peta Ellis 🌈,ellispeta,Proud mother. Human transformation architect. Human behaviour|Startups|Innovation|Change| CoFounder @peakpersona @thetribebuilder EIR @QUTEship,Brisbane Australia,https://pbs.twimg.com/profile_images/879166411351891968/zBp2hBw6_normal.jpg,https://t.co/yqdFI1SoiC,0,12123,13148,17792,443
331694424,Claudio Palavecino,PalavecinoCL,"“Locos tiempos me tocó vivir, y yo no he fallado en ser insensato también, como el tiempo me lo pedía.”",,https://pbs.twimg.com/profile_images/1355312782040821765/-EDKQ3jI_normal.jpg,,0,12118,5687,71488,71
24771318,Osha Davidson,OshaDavidson,"Author of ""The Best of Enemies,"" and a New York Times Top Book of the year. Producer and host of the 5-⭐️ podcast, ""The American Project.""","Phoenix, AZ, USA",https://pbs.twimg.com/profile_images/1353171865804525569/U-DLjbGc_normal.jpg,https://t.co/xNElr8gBRi,1,12114,6779,19916,772
767362,Davey Winder,happygeek,"Freelance Technology Journalist
davey@happygeek.com


Bylines: @Forbes, @guardian, @ObserverUK, @pcpro, @SCMagazineUK, @InfosecurityMag, @digitalhealth2","West Yorkshire, UK",https://pbs.twimg.com/profile_images/1292833331550343168/VsUs0ciR_normal.jpg,https://t.co/N4q0txpFqE,0,12106,2821,10170,454
21178944,Action for Animals,action4animals,,,https://pbs.twimg.com/profile_images/1979122482/LOGO2_normal.jpg,,0,12085,4095,2105,312
923574392,Aidan Regan,Aidan_Regan,Associate Professor | @ucddublin | Political Economy | Public Policy | Alumnus @EuropeanUni @mpifg_cologne @UvA_amsterdam | Columnist @businessposthq,,https://pbs.twimg.com/profile_images/1202295726639910914/37DFMTeR_normal.jpg,https://t.co/cEIj7Tg7Wj,1,12070,1856,17911,161
82076405,Arun Janardhanan,arunjei,Works with The Indian Express,"Chennai, India",https://pbs.twimg.com/profile_images/1263473943492599813/yHQ3_ovl_normal.jpg,https://t.co/C0EfFUSPq6,1,12068,3182,11751,72
369731759,Global Observatory,ipinstGO,"Produced by the International Peace Institute (@ipinst), the Global Observatory provides timely analysis on trends and issues related to global security.",New York,https://pbs.twimg.com/profile_images/1141412272780304385/fqJ4Kl8s_normal.jpg,http://t.co/4E0NWfztCV,0,12054,1122,7137,234
18374425,Ahmar Mustikhan,mustikhan,"Gay, Writer, UU. Ars Longa, Vita Brevis",North America,https://pbs.twimg.com/profile_images/1099687684602241024/bTEMqU1O_normal.png,https://t.co/KJcwCznV6p,0,12044,13295,118691,167
2903598591,Nicky Kyle Gardening,nickykylegarden,#Organic grower/farming #realfood #kefir advocate 40+yrs. #Ethical omnivore broadcaster #LCHF Co-founder @organictrust #HealthySoil=#HealthyPeople/#biodiversity,Co. Dublin Ireland. No DMs pls,https://pbs.twimg.com/profile_images/540104913515061248/ZAJB47UC_normal.jpeg,http://t.co/MFD6OOSvt3,0,12028,6127,56280,494
57963979,イシケンTV / The HEADLINE 編集長 / 石田健,ishiken_bot,📰YouTube と @theheadline_jp でニュース解説者 🤟現代ビジネスやダイヤモンド、サンジャポ、Abema TVなど寄稿・出演 📌東証一部上場企業に企業売却後、ベンチャー投資など 🎓早稲田大学院政治学研究科修士課程修了 💡関心領域は政治思想、近代東アジア、テクノロジー時代の倫理と政治,新宿 / 高田馬場,https://pbs.twimg.com/profile_images/1300150514902941696/FRP7vjv8_normal.png,https://t.co/lXrr8xrLix,0,12018,1043,35564,211
14197312,Doug Mataconis,dmataconis,"Lawyer, libertarian, #Yankees fan, blogger. I'd rather laugh with the sinners than cry with the saints. RTs ≠ endorsements. I was #NeverTrump before it was cool","Virginia, New Jersey, The Wind",https://pbs.twimg.com/profile_images/907568140434804742/b18VjoDK_normal.jpg,http://t.co/nH2xyvQO1g,0,12002,8296,490704,744
407798779,Laura Barrera,laurabarrera99,Periodista/productora #Noticias22 #InstintoAnimal @HorizonteJazz #ElSoundtrackDeUnaVida @AZTVdePaga #TecnoTag Mi libro:#VeganoYo? Mi lugar: @purple_veg,México,https://pbs.twimg.com/profile_images/722615306997207040/XALGX6Gq_normal.jpg,https://t.co/NmUThm6N1T,0,11994,6070,10699,144
2776693115,Patrick Loobuyck,PLoobuyck,Politiek filosoof UA en UGent. Auteur van Verdwaald in Verlichting (2019) Samenleven met gezond verstand (2017) De seculiere samenleving (2013) #LEF,,https://pbs.twimg.com/profile_images/1218223888615858182/2ySwkpda_normal.jpg,https://t.co/7ZOOJ10MIA,0,11986,506,11919,53
296453816,Laura Arrillaga-Andreessen Foundation,LAAF,"Education and resources to give, live, & lead in a way that matters more","Menlo Park, CA",https://pbs.twimg.com/profile_images/1123721516435349504/wrrpsE-f_normal.png,https://t.co/p9NZ192IMx,1,11984,1303,3417,469
3335039729,atsu,atsudavoh,God bless our homeland.,Nairobi,https://pbs.twimg.com/profile_images/1356908029556498436/BJ2tiXvN_normal.jpg,,0,11965,1365,19371,76
16067473,Olga Weiss,olgaw,"Artist, designer, consciousness explorer & yoga teacher.","Santa Monica, CA",https://pbs.twimg.com/profile_images/542173182812123136/EJPjtz-s_normal.jpeg,https://t.co/5FeziOu1E5,0,11960,2838,746,88
15859570,timdunlop,timdunlop,"Writer. 
https://t.co/f73JFKDbIY","Melbourne, Australia",https://pbs.twimg.com/profile_images/1012540222486216704/BPaW7PjC_normal.jpg,https://t.co/16xGKPox5c,0,11959,1576,23654,298
19375688,Justin Robertson,robertsonjustin,"Dj, Broadcaster, Artist, Writer, Producer .Bookings. caroline@spunoutagency.com",london,https://pbs.twimg.com/profile_images/968955407053021184/FbB7lKy4_normal.jpg,https://t.co/DxmwfpCjmx,1,11959,1437,15813,181
1331726551,Juan Cla,JuanCladeRamon,"Moderadamente huraño, sentimental con sordina. Escribo aquí y allá. Mis opiniones son sólo mías. Espabilando la vela en https://t.co/IXubL2LBKV",España,https://pbs.twimg.com/profile_images/1299796655559061504/r-9aPQiQ_normal.jpg,,0,11955,2149,38498,178
126681958,Global Policy,Global_Policy,We are the Global Policy Journal and Research Institute. We provide state of the art expertise on global collective action problems. RTs are not endorsements.,"Durham University, School of Government and International Affairs",https://pbs.twimg.com/profile_images/462162490864828417/_a_hhRgn_normal.png,http://t.co/OgkdLNmCBL,0,11937,4365,48246,579
9695912,Martin Grüner Larsen,martingruner,Dansk bergenser bosatt i Oslo. Kommunikasjonsrådgiver i @SVparti.,"Oslo, Norway",https://pbs.twimg.com/profile_images/727223840867233792/h7nTO0jX_normal.jpg,http://t.co/aTKyLH3DXj,0,11934,7922,50232,197
27152529,Álvaro Ramis,alvaroramis,Rector @U_Academia. Profesor escuela de Ciencia Política y RRII.,Santiago de Chile,https://pbs.twimg.com/profile_images/1337562460342132737/zOR9mhAe_normal.jpg,,0,11928,4818,122215,86
416403221,Alysson Augusto,alystoteles,Mestrando em Filosofia pela @PUCRS. Ética Animal. Youtuber (https://t.co/nH4Dr9JbQl) 😬 Altruísta Eficaz (siga @alteficazbr),"Porto Alegre, Brasil",https://pbs.twimg.com/profile_images/1352631774669639698/mhMoBm93_normal.jpg,https://t.co/s9CR28wOVn,0,11920,818,25535,57
23958608,Cathleen,VeganNutrition,"Founder of Vegan Nutritionista, author of The Vegan Bread Box, Cut the Cheese, Vegan Meal Plans, https://t.co/AZlYAjwwPO",USA,https://pbs.twimg.com/profile_images/2206925389/straighthair_normal.jpg,https://t.co/JwbiU4T4JU,0,11919,1587,749,299
25209069,Tammy Tibbetts | 📙 #ImpactBook,tammytibbetts,Co-Founder/CEO of @shesthefirst | @TCNJ Alumna/Trustee | Author of Impact: A Step-by-Step Plan to Create the World You Want to Live In (available now!),New York City,https://pbs.twimg.com/profile_images/1329911470751178755/vuuTIfa1_normal.jpg,https://t.co/9DhdhJ33lg,0,11906,3727,36812,478
405212879,"🔬Samantha Yammine, PhD 🏳️‍🌈",SamanthaZY,Neuroscientist & Science Communicator: @heysciencesam & https://t.co/HRzUgNpsE9 (she/her),"Toronto, Ontario",https://pbs.twimg.com/profile_images/960365543596404736/AILe2GUN_normal.jpg,https://t.co/Zy3fUsSD3T,0,11888,1953,14713,279
9269,Simone Brunozzi,simon,Tech. Founder. Investor. Trying to become useless as fast as possible.,"Mars, Solar System, Milky Way",https://pbs.twimg.com/profile_images/547974249315459072/oUcEI5VU_normal.png,https://t.co/Pvus3DdPnR,0,11888,1561,14283,799
3598812326,ScienceTime,sciencetime_jp,"Update your mind, It's ScienceTime│科学やテクノロジーに関するニュースや一般向けのコンテンツをシェアします│倫理的発展のための科学と技術の推進│物理アカウント→ @ST_phys_bot │",,https://pbs.twimg.com/profile_images/826324237472247809/wa6HYWpi_normal.jpg,https://t.co/Mcyw3RgCjy,0,11883,401,17241,163
33462545,Yap Pheng Hui 葉鵬飛,yapphenghui,"No Direct Message please  新加坡、東京、台北、北京、新加坡，father of two, husband of one.  文字匠，腰肌勞損，梅门平甩功。SINGAPORE, TOKYO, TAIPEI, BEIJING, SINGAPORE",Singapore,https://pbs.twimg.com/profile_images/2206236724/_____2012APR-1_tweeter_normal.jpg,https://t.co/h3oPyz9EAh,0,11872,9985,120901,160
7.11E+17,Mustapha Itani,mustaphahitani,"Writer, translator and analyst.",Beirut,https://pbs.twimg.com/profile_images/1312322013428580353/EVRWv9FO_normal.jpg,https://t.co/zU2DIYTXfF,0,11854,1908,2531,97
57523002,Rob Goldman,robjective,Solutionist seeking problems. Husband and dad. Seeker and student. Rational and optimistic.,San Francisco,https://pbs.twimg.com/profile_images/922682720584531968/ukhi1Op4_normal.jpg,,1,11853,1223,559,212
221849969,The Point Magazine,the_point_mag,"A magazine founded on the suspicion that modern life is worth examining.

Join our newsletter: https://t.co/CjNReOld0r
Subscribe: https://t.co/fpvNWsErYg","Chicago, IL",https://pbs.twimg.com/profile_images/964546545889759232/Xkn8b0pT_normal.jpg,http://t.co/QV9prYnta5,0,11839,1757,13429,261
17154022,Abdurrahman Warsameh,warsameh,"Freelance journalist and blogger about Somali politics, economy and society. Usual caveats apply.","Minneapolis, MN",https://pbs.twimg.com/profile_images/1332530443619618816/jto6zMQ4_normal.jpg,https://t.co/Mwe4Hm0KAw,0,11836,2045,1187,87
3165955997,Centre for the Study of Existential Risk,CSERCambridge,A Cambridge University research centre dedicated to the study and mitigation of risks that could lead to human extinction or civilizational collapse.,"Cambridge, England",https://pbs.twimg.com/profile_images/925400508067647489/6W8YqlWI_normal.jpg,https://t.co/FRMtQEU4jj,0,11828,844,4950,268
141296076,Vegan Bodybuilding,vbbook,http://t.co/2db3xSgDIx by  @RobertCheeke,"Los Angeles, CA",https://pbs.twimg.com/profile_images/579702105050521600/9DUYoi7o_normal.jpg,http://t.co/2db3xSgDIx,0,11816,12513,13986,216
26004544,Anna Dorfman 🥯,doorsixteen,I design book covers: https://t.co/3exXd0t0Cn 〰️ I have a blog: https://t.co/zDHmzxyFJh 〰️ I have a shop: https://t.co/uHHBYucLsK 〰️ she/her 〰️ #LGM,Brooklyn ✈️ Santa Fe,https://pbs.twimg.com/profile_images/1297740143919431680/5db-SwGH_normal.jpg,https://t.co/zDHmzxyFJh,0,11808,681,98929,468
17666727,Graham Readfearn,readfearn,Journalist doing climate and environment @GuardianAus https://t.co/W6UBebViSs Dad. Burnley fan. Ops mine. DMs open.,"Brisbane, QLD, Australia",https://pbs.twimg.com/profile_images/1814612620/graham_normal.jpg,https://t.co/r6m2yHjnMb,1,11807,6361,15061,524
48151976,Yaser Mirdamadi,ymirdamadi,"Researcher in Muslim biomedical ethics, the Institute of Isma'ili Studies, London. PhD in Islamic studies, University of Edinburgh, Scotland. Also a translator.","Manchester, England",https://pbs.twimg.com/profile_images/1252031431741714437/qnm8HzSx_normal.jpg,https://t.co/vUNfDY4IT0,0,11796,2457,16208,66
91156911,William Brangham,WmBrangham,PBS NewsHour https://t.co/MskE8S2cZY wbrangham@newshour.org,Washington D.C.,https://pbs.twimg.com/profile_images/1339279049819086852/66aDedpQ_normal.jpg,https://t.co/p8o4uhbm4H,1,11795,1291,5093,183
615818451,Alexandr Wang,alexandr_wang,ceo at @scale_ai. rational in the fullness of time,"San Francisco, CA",https://pbs.twimg.com/profile_images/775445981034795008/R3D5PQLN_normal.jpg,https://t.co/VUspJXOVBn,0,11791,493,910,159
61130059,Mirelle Ortega,moxvi_,"🇲🇽 Illustrator & concept artist. Clients include HarperCollins, Scholastic, Benchmark and Little Bee. Repped by @BrightAgencyUS - IG: msmirelle","California, USA",https://pbs.twimg.com/profile_images/1250850224135745536/Pfl7-NQk_normal.jpg,https://t.co/rkDFrsOZE1,0,11784,1303,30395,155
123220773,Hetan Shah,HetanShah,CEO @BritishAcademy_ Visiting Prof @PolicyatKings Vice Chair @AdaLovelaceInst Trustee @StGeorgesHouse Tweets my own,London,https://pbs.twimg.com/profile_images/575963450045677569/mY4H0cfL_normal.jpeg,https://t.co/qJ87AHLMX8,0,11782,1950,25792,344
2981426032,Les Parasites,Les_Parasites,Il était une fois Les Parasites... #web #cinéma,,https://pbs.twimg.com/profile_images/835925391571320836/7HkCAdTM_normal.jpg,https://t.co/624Marh1Tf,0,11773,517,5331,46
866636593,Dr Finn Mackay Adult Human Queermale,Finn_Mackay,Sociology Lecturer @ best Uni in Bristol. My book 'Radical Feminism: Activism in Movement'. Forthcoming book - 'Female masculinities & the gender wars',“European Union 🇪🇺”.,https://pbs.twimg.com/profile_images/1341389393395912706/U1NDRI2v_normal.jpg,https://t.co/Ng48JtfBwq,0,11752,6470,54365,169
14913454,David Pizarro,peez,Contemplate war over a cup of warm coffee,"Ithaca, NY",https://pbs.twimg.com/profile_images/832431104963575808/Db9IbwBP_normal.jpg,https://t.co/pQOoCOPKSW,0,11749,502,1755,148
14081052,Trevor Blackwell,tlbtlbtlb,PhD in CS. Robotics. @ycombinator. https://t.co/SJCqJxYs19,Silicon Valley,https://pbs.twimg.com/profile_images/1250957870927015937/njG_w37m_normal.jpg,http://t.co/XwCIwdkiJ5,0,11716,516,1919,320
3092760197,Robert H Frank,econnaturalist,"Cornell U; author, The Economic Naturalist, Success & Luck, and Under the Influence (Jan 2020, @PrincetonUPress: https://t.co/ITZZUZRm8G","Ithaca, New York",https://pbs.twimg.com/profile_images/577829306522423296/Mkknkp8p_normal.png,,0,11708,2513,3747,336
157958467,Alison Johnstone,AlisonJohnstone,"Green MSP, Lothian region. Spokesperson Health & Sport, Children & Young People & Social Security. Fabulous photos of wildlife by https://t.co/3BG4kaTkUW",Edinburgh,https://pbs.twimg.com/profile_images/1177702008746323968/RYVNtGsb_normal.jpg,https://t.co/vpMKHh4ryL,0,11687,4863,17589,308
519071841,Matthew Oldridge,MatthewOldridge,"""Just a man"". Father, husband, educator, thinker about things. Professionally: curious about the world. Not: too much of a joiner.","Mississauga, ON",https://pbs.twimg.com/profile_images/1296449120916385798/0SRngIKK_normal.jpg,,0,11684,10068,55673,343
169024054,Greenpop,Greenpop,(Re)connecting people with our planet.,Southern Africa,https://pbs.twimg.com/profile_images/892330481370505216/82CVgEzl_normal.jpg,https://t.co/01LkjaLQd4,1,11680,5371,23000,202
607369499,Andrea Illy,andrea_illy,"Chairman, @illycaffe. Chairman, The Regenerative Society Foundation. Advocate #VirtuousAgriculture.",,https://pbs.twimg.com/profile_images/974388352236613634/bLw49AF5_normal.jpg,,1,11673,1361,5165,202
215341878,loretta schrijver,lmschrijver,"Koffietijd, z docs, natuur op 8, Flip en Moor",,https://pbs.twimg.com/profile_images/1172469921/NIB-hansbrongers_normal.jpg,,0,11671,402,1463,69
106476153,Andrew Westoll,ADWestoll,Nonfictioneer. Novelist. Associate Professor at UTSC. Latest book is THE JUNGLE SOUTH OF THE MOUNTAIN. Next book is all about the modern zoo.,Toronto,https://pbs.twimg.com/profile_images/751112825045716993/zY3n5xa-_normal.jpg,http://t.co/2NPgXlcQSm,0,11666,839,3168,144
30940684,©arniWay.nyc - Travis Statham,Travis_Statham,https://t.co/LJnazDRDq7 https://t.co/NbrfFZ9iBW https://t.co/lWTSerSE6X https://t.co/xPSk78QSCG #CarnivoreDiet #Ketoscience NYC,"Brooklyn, NY",https://pbs.twimg.com/profile_images/1333160512398487552/v1SFLcBt_normal.jpg,https://t.co/9mWF1RNNiF,0,11662,9185,49317,188
42900861,Ann Marie LaFlamme,AnnMarieLaFlamm,Emmy Award Winning Reporter & Anchor | Follower of Jesus | Dog Mom | Proud Lifelong Michigander,Detroit,https://pbs.twimg.com/profile_images/1135847627541626883/fo_USvJd_normal.jpg,https://t.co/hVy1J55hLm,1,11662,2673,19582,143
8.85E+17,Barry Michaels Was For The U.S. Senate,Barry4USSenate,"Prior Candidate for the U.S. Senate with knowledge, experience, common sense and vision to make our nation a better place.","Las Vegas, Nevada, USA",https://pbs.twimg.com/profile_images/922454931784609792/y3cfk0Rr_normal.jpg,https://t.co/bnlha1MihE,0,11659,31266,3536,29
28528503,Tim Ireland ⚜️🔥🎤,bloggerheads,Poet. Know it. Agnostic evangelist. Fire wizard: https://t.co/xYMnpGSAsV Political writer: https://t.co/MmWa7SETMk Joy creator: https://t.co/swT5llzHtB  I'm a humanist: I believe in you.,"Peaksville, Plague Island",https://pbs.twimg.com/profile_images/596591826590629888/MDb5sSMs_normal.png,http://t.co/GU6YGHQjle,0,11641,11580,196464,348
2672726674,Adrian Bethune MCCT,AdrianBethune,Teacher | Governor | Co-author Teacher Wellbeing & Self care |  https://t.co/gJX2qr6H5i… | Ed Policy Co-lead @MindfulNationUK | Founder #teachappy,Hertfordshire,https://pbs.twimg.com/profile_images/1340335479225524225/hxTxE7zX_normal.jpg,https://t.co/tnfN2QzsJV,0,11635,6185,28631,53
81864805,Victoria Adams,ToriinDC,"#blockchain #opioidcrisis #opioidepidemic #ethereum #hyperledger #covid19 #crypto #cryptocurrency #SSI #fintech #healthtec #defi 
https://t.co/gMtQpQlytc",Washington DC,https://pbs.twimg.com/profile_images/1249373794109722624/E-A_zROF_normal.jpg,,0,11630,2105,13162,507
125965499,Munkhsaikhan O.,munkhsaikhan_o,"Doctor of Law, Professor, School of Law, National University of Mongolia",Mongolia,https://pbs.twimg.com/profile_images/1135006657941913600/6lOLSBUe_normal.png,https://t.co/zhZna5UZxd,0,11587,726,23862,41
350016667,Sam Grafton,SquidPoker,Amy Adams fan account,"London, England",https://pbs.twimg.com/profile_images/1350525682015735808/SyCEeLbr_normal.jpg,,0,11585,2043,8273,138
45674330,GRAY,oceanshaman,"I champion Healthy, Functioning Ecosystems: Water&Land:NEVER MORE AT RISK.As are ALL species who depend upon them. #Resist!",Tropical SE Palm Beach Co FL,https://pbs.twimg.com/profile_images/965775663365087233/eX-Bb65u_normal.jpg,https://t.co/eU9tqIQYCR,0,11571,13559,588293,1067
11741632,Amy Gray,_AmyGray_,"Area recluse. Words: ABC, Crikey, books & elsewhere. Dart sommelier.",On the couch,https://pbs.twimg.com/profile_images/1292324148316745728/a1e1Ymks_normal.jpg,,1,11529,3961,53189,296
9.06E+17,Machine Learning Department at CMU,mldcmu,"Ranked as the #1 educational research institution in the 🌎 for #AI and #machinelearning | #BlackLivesMatter | Research 
 → https://t.co/FSCSXdTdjS | Learn more ↓","Pittsburgh, PA",https://pbs.twimg.com/profile_images/1290372931403603968/ZwjcfpSq_normal.jpg,https://t.co/nFvRolruTH,0,11523,4651,2351,193
67278209,Peter Glaser,peterglaser,Ich schreibe.,Berlin,https://pbs.twimg.com/profile_images/372004147/peterglaser_normal.jpg,https://t.co/QhiMTnVSqE,0,11513,2482,51706,499
29355352,Melissa Sehgal,Melissa_Sehgal,"Animal Communicator & Intuitive Medium 
Mom to cats, dogs & pigs. 



I TWEET TO INSPIRE.","Friday Harbor, WA",https://pbs.twimg.com/profile_images/1343409192632111105/uTWtXr6L_normal.jpg,https://t.co/978qNegggT,0,11507,308,19935,244
158461349,Vicente Luis Mora,MoraVicenteLuis,"Escritor, crítico literario, lectoespectador.","Córdoba, España",https://pbs.twimg.com/profile_images/3170767930/49dd6bb778327585683159496b0a4fb0_normal.png,http://t.co/EhHClmXgei,1,11500,2238,13969,380
3346224705,Alex Emmons,AlexEmmons,"Reporter @TheIntercept. Struggling chess player. He/him. Send tips / get in touch: 703-624-4050 (Use Signal), emmons@protonmail.com","Washington, DC",https://pbs.twimg.com/profile_images/976292924680937473/w0NKfFkH_normal.jpg,https://t.co/s8dNJj6161,1,11500,1381,1894,259
92293854,Jason Ball,jasonballau,Young @ausoftheyear for VIC. @PrideCup Co-Founder. @Greens candidate 2016 & 2019. @VicHealth Champion. Ambassador @beyondblue @humanrightsfest @VicPrideCentre,Melbourne,https://pbs.twimg.com/profile_images/1099558923684655104/8vg6iRZu_normal.jpg,https://t.co/iz1iLIAwJn,1,11495,3422,10512,195
1042055749,DIGNITY SA,DignitySAfrica,"#DignitySA - an NPO committed to legalising #AssistedDying in SA. To making humanity humane. It's all about #Compassion, #Autonomy, #Choice and #HumanRights",South Africa,https://pbs.twimg.com/profile_images/536828035647803392/jfUKbLGm_normal.jpeg,https://t.co/4vywVwxWvE,0,11481,11639,10773,41
18341432,Operation Fistula,OpFistula,mapping gender inequality in our effort to end obstetric fistula for every woman everywhere,Austin / London,https://pbs.twimg.com/profile_images/532381733/IMG_2882_2_normal.jpg,https://t.co/NqSTaW4Yv1,0,11433,6689,5517,494
220271264,Fernando Nieto Morales,fnietomorales,Professor of public administration @ElColmex | Partner @Brocoli_mx | Organizational scientist schooled @univgroningen,"Ciudad de México, México",https://pbs.twimg.com/profile_images/1342135098230108160/DoSSkT66_normal.jpg,https://t.co/bPbmC6DBqa,0,11429,787,14136,83
53292926,Julie McCrossin AM,JulieMcCrossin,Broadcaster. Cancer survivor. Dog lover. @TargetingCancer @HNCancerAus @TROGfightcancer Head & Neck Cancer 2020 Videos host  https://t.co/rj2gGoLxKK,Sydney Australia,https://pbs.twimg.com/profile_images/1181814467203461121/7K587fmp_normal.jpg,https://t.co/MxOPL73PuA,0,11408,12527,46122,135
43564999,Somatosphere,somatosphere,"Covering medical anthropology & social sciences + humanities of medicine, health, and biosciences. Tweets by @taliargordon & @eraikhel.",,https://pbs.twimg.com/profile_images/885495823609540608/k-ix_SAb_normal.jpg,https://t.co/kGdE3EqHuQ,0,11366,4702,18743,514
156366733,MASS Design Group,MASSDesignLab,"Architecture is never neutral. It either heals or hurts. Our mission is to research, build, & advocate for architecture that promotes justice and human dignity.",Boston • Kigali,https://pbs.twimg.com/profile_images/657284418709536768/_PjZUeB-_normal.png,https://t.co/oqXZ1Ep2EZ,0,11362,1732,4553,335
