id,name,username,description,location,profile_image_url,url,verified,followers_count,following_count,tweet_count,listed_count
70097379,MilanoX,milanoics,"eretici dal 2010: odiamo fascisti e leghisti, amiamo precarie e riot, ma soprattutto siamo lo sguardo polemico e sovversivo su Milano",NoMilaNo,https://pbs.twimg.com/profile_images/378800000427851612/26ae5e681900fd2979f86cf86f9bf068_normal.jpeg,https://t.co/8QtyJM330G,0,7392,5725,70855,261
27810354,Rob Wile,rjwile,"business, tech, and the economy in south florida for @miamiherald. email: rwile@miamiherald.com. dm for signal","Miami, FL",https://pbs.twimg.com/profile_images/1355018704615071744/ii_2geUa_normal.jpg,,1,7391,9978,7126,324
7790952,Martín De Ambrosio,mdeambrosio,"Periodista científico, digamos. Escribí sobre cambio climático antes que el Papa (y sobre el coronavirus desde enero). Ahora https://t.co/PkrqVKb497",,https://pbs.twimg.com/profile_images/837172484122243072/muE_h4ZF_normal.jpg,http://t.co/mphO3dVzWB,0,7390,2511,24971,119
18514268,Chris Berry,cberry1,"Energy metals supply chain analyst. Focused on materials, macro cycles & absurd valuations. Interests: longevity & loud music. ""The Voice of Reason""",NYC/DC,https://pbs.twimg.com/profile_images/919740512621486081/-YnWW0Uh_normal.jpg,https://t.co/JdC23ZPEsu,0,7386,3937,8004,161
127307617,Animal Libre,Animal_Libre,"Organización que trabaja por el respeto y la consideración moral hacia los demás animales. Presente en Chile, Argentina, Perú, Ecuador y Paraguay.",Internacional,https://pbs.twimg.com/profile_images/1104370351008567296/EtsRrOHJ_normal.jpg,https://t.co/c1oOnW6A25,0,7383,1030,5206,54
28142742,Sandra Lafuente,sanfue,"Hago periodismo, escribo, edito, traduzco. Tengo tierra en vez de patria. El sacrificio está sobrevalorado (Foto: la gran Corina Arranz)","Barcelona, España",https://pbs.twimg.com/profile_images/950675217571082240/Mw84-dlH_normal.jpg,,0,7380,5585,4832,139
17285408,Paul Wallbank,paulwallbank,"Comms guy, sometimes tech journo and stand-in editor. Once described by a Prime Minister as 'brain damaged'. Tweets are the product of my own febrile mind.","Sydney, New South Wales",https://pbs.twimg.com/profile_images/1139990552751923200/TLt-ToI-_normal.png,https://t.co/dPfWb1NgTt,1,7375,2070,53807,529
43326045,Ashwani🌱Garg 🇺🇸 ☯禅☸️ 🌏☮️🇮🇳,agargmd,#lifestylemedicine #plantbased #vegan #mindfulness #straightedge #Zen #禅 #meded #GiftedEd|Tweets≠med advice|Tweets my own|RT≠endorsement|Some tweets parody,"Chicago, IL",https://pbs.twimg.com/profile_images/516125344839901184/pdnejMJx_normal.jpeg,https://t.co/nR5MHSHLN4,0,7373,8125,161850,388
245830631,Tom Micklewright,LondonVeganSoc,Promoting plant-based eating for people and planet,London,https://pbs.twimg.com/profile_images/1354072853126254593/y8ebi4AJ_normal.jpg,,0,7373,3615,9871,143
5717402,Benedikt Koehler,furukama,CEO & Founder @DataLion_EN • Number Cruncher • PhD @LMU_Muenchen • Slow Media Manifesto-Writer • Retired Rock'n'Roll Star • Dad & Dog-owner,"München, Bayern",https://pbs.twimg.com/profile_images/893596828381433858/Joi16Ql0_normal.jpg,https://t.co/7q6mTve6Pf,1,7368,4683,32121,744
15191548,nevona,nevona,product; new york; white canvas sneakers; i wear a helmet,soho,https://pbs.twimg.com/profile_images/1258544378307645442/WiERhJD9_normal.jpg,https://t.co/2V83gOGnKp,0,7366,3650,40270,64
76108364,Gregory B. Sadler - mask up and maintain distance!,philosopher70,"speaker, author, philosopher | YouTube philosophy guy | editor Stoicism Today | co-host Wisdom For Life show | host Sadler's Lectures podcast | teaches at MIAD","Milwaukee, WI",https://pbs.twimg.com/profile_images/1335676631327928320/mGouhUcp_normal.jpg,https://t.co/nRfmNcM8QX,0,7365,1655,23638,187
309798935,Fredrick Kunkle WaPo,KunkleFredrick,"Washington Post staff writer, former Guild co-chair & 1A absolutist. Democracy dies when Big Tech controls what we buy, sell, watch, read, tweet, share, etc.","Washington, D.C.",https://pbs.twimg.com/profile_images/1192480826036019207/0eyel0AY_normal.jpg,https://t.co/JCdIMrSzdQ,1,7360,1693,8780,248
37352138,Dola Mohapatra,DolaMohapatra,Still learning...,Worldwide,https://pbs.twimg.com/profile_images/1346079848310050816/pEcurPlA_normal.jpg,http://t.co/4IdVsXf0xa,0,7356,8013,35933,362
36224586,Alan Sunderland,asunderland,"Author, Journalist. Exec Dir, Organization of News Ombudsmen: https://t.co/2sEwepH5Sk. Views here my own. Official ONO tweets at @ONOOrgOmbuds",Sydney,https://pbs.twimg.com/profile_images/1357057877878341633/8CakO1d__normal.jpg,https://t.co/4Irt9uCz3m,1,7350,1967,7249,160
5863392,Anne Rongas,arongas,"Nettiope, sometutkailija, opiskelija, yrittäjä, mummo, harrastaa miettimistä. Ideatarhuri Otavia ja Nettilukio. Etätyötä Miehikkälästä maailmalle since 2010.",Finland: Miehikkälä,https://pbs.twimg.com/profile_images/459602082631127040/O7VJlsfr_normal.jpeg,https://t.co/8nxxwKjj5S,0,7350,5978,6958,220
357661916,Simon Lewis,SimonLLewis,"They say I’m outspoken. Author, The Human Planet. Professor of Global Change Science @UCL & @UniversityLeeds. Trying to understand the world, and change it too.",London,https://pbs.twimg.com/profile_images/1502238482/slewis_hands_normal.jpg,,0,7345,1377,14801,175
21690595,John W McArthur,mcarthur,"Optimist. Economist. Director, Center for Sustainable Development @BrookingsInst. Senior advisor @unfoundation. 🇨🇦 #BlackLivesMatter",,https://pbs.twimg.com/profile_images/1283204021835071488/3P5IOp-x_normal.jpg,https://t.co/BH6vOZf8Kc,0,7339,1501,4523,323
16326159,Andrew Chubb,zhubochubo,"South & East China Sea, CCP foreign policy, PRC public opinion, IR in East Asia / British Academy postdoc @LancasterUni @LancasterChina",,https://pbs.twimg.com/profile_images/891990778829864960/lCdO869v_normal.jpg,https://t.co/jqEcQIPNrd,0,7337,3182,11237,273
24323815,Divyanshu Pota,divypota,Writer | Producer | Engineer,"Sydney, Australia",https://pbs.twimg.com/profile_images/1112914534434525184/Zjya_uw1_normal.jpg,https://t.co/5qVovPPjYY,0,7335,620,7661,20
580309817,Fraser Myers,FraserMyers,Assistant editor @spikedonline + spiked podcast,"London, England",https://pbs.twimg.com/profile_images/1296978100115451904/haqT4Uk1_normal.jpg,https://t.co/QFmaQwwW98,0,7328,4379,19372,68
4105731154,Cheap Lazy Vegan,cheaplazyvegan,I make videos about food and stuff on YouTube - https://t.co/DCjJQOuUKs,Canada,https://pbs.twimg.com/profile_images/1213419750493081600/oeahX6cr_normal.jpg,https://t.co/rNtFif0obO,0,7326,1052,4043,75
297888385,Andy Clements,_AndyClements,"Passionate in using evidence to help recovery of nature. Natural England Board member, chair NE Science Advisory Committee (NESAC). Birder, Sculler",Cambridge and Norfolk,https://pbs.twimg.com/profile_images/1322958918306406400/f-36FZNG_normal.jpg,,0,7312,2224,23521,134
222330241,Equality Rights,eraaustralia,"Australia's largest network of organisations advocating for women's equality, women's leadership, and the diversity of women. RT ≠ endorsement.","Canberra, Australia",https://pbs.twimg.com/profile_images/1272318845009580032/s6MRSo1k_normal.jpg,https://t.co/PoxIauoWVi,0,7302,4256,18699,153
26259889,Elmhurst University,elmhurst_u,"News and updates from #ElmhurstU, a private university founded in 1871 and located in the western suburbs of Chicago!","Elmhurst, IL",https://pbs.twimg.com/profile_images/1278312024741761027/cMpWECIg_normal.jpg,https://t.co/EZgY0HRXeG,0,7302,530,5440,126
121281358,Conexão Pet,ConexaoPet,"Um portal para quem ama animais, com informações qualificadas e uma incrível revista digital!",Curitiba,https://pbs.twimg.com/profile_images/752603925468090369/BUMKyGRp_normal.jpg,http://t.co/PoOAa5KxEY,0,7299,268,12497,91
15967436,Steve Pennells,pennells,Journalist/presenter. Five-time Walkley Award winner. One of the faces of the @2020mentalityp1 and @nomoreorg. Email: steve@pennells.com,Sydney,https://pbs.twimg.com/profile_images/997695307621126144/0r0LFUcc_normal.jpg,,1,7292,2628,2875,133
46026799,TheAtheistMissionary,AtheistMission,"I aspire to be wise, rather than smart. LL.B. Tweeting atheism, philosophy, politics, stoicism, NFL & whatever. All views are those of my employer.","Georgian Bay, Ontario, Canada",https://pbs.twimg.com/profile_images/469510517266972672/KINxCRjO_normal.jpeg,,0,7286,6361,31432,371
109655627,University Book Store,ubookstoresea,Seattle's Original Independent Bookstore / Est. 1900 / Serving the UW 💜💛 #howihusky / Supporting local readers 📚 #ubsbooklover,"Seattle, WA",https://pbs.twimg.com/profile_images/1145814251660955648/zib8g4vB_normal.png,https://t.co/g5VDj6TttO,0,7285,2261,15603,306
479784413,AQ,Evollaqi,"Oxford and Cambridge alum. Interested in philosophy, politics, and Islam.",United Kingdom,https://pbs.twimg.com/profile_images/3591028264/f9f363b43759bc31add3d623dde44167_normal.jpeg,,0,7284,4882,24560,42
106230431,ALFⓋAnimalLib,ALFAnimalLib,Info&communiqués from the ALF. Abolitionist vegan&AR news with commentary. Provided for lawful purposes only. Illegal activity strictly discouraged.,Everywhere,https://pbs.twimg.com/profile_images/1066336183/redALF_normal.jpg,,0,7280,1555,25922,194
143298835,Nicolás Medina Mora,MedinaMora,Inquilino del Gran Hotel Abismo. Escritor y editor en @nexosmexico.,Ciudad de México,https://pbs.twimg.com/profile_images/1136840434171359232/FKltQ3T-_normal.png,,1,7276,1916,1053,212
8382852,Aartjan van Erkel,Aartjan,Auteur bestverkochte managementboek vh jaar ★ Professioneel spreker ★ Trainer ★ Copywriter ★ Online marketing & sales expert,Zeist,https://pbs.twimg.com/profile_images/1132171299026079744/YJ7GA1Qf_normal.png,http://t.co/k23cKecEul,0,7269,3842,25670,353
106844256,Tania Busch Venthur,taniabusch,Abogada. Doctora en Derecho. Secretaria en @Achiderconst . Presidenta de @FundamentalDDHH,,https://pbs.twimg.com/profile_images/1338093193519357953/EWd4GOHV_normal.jpg,https://t.co/HbleMWm12n,0,7264,2877,5285,56
148998247,Alex Bhathal,alexbhathal,"’Towel-headed loser’; also Social Worker; social/race/eco justice; National Director AASW; Lecturer, refugee advocate. The truth: https://t.co/XoL88Mn7RY",Wurundjeri Country (Preston),https://pbs.twimg.com/profile_images/1356169575549726722/U3lSbD8p_normal.jpg,https://t.co/3dsyV8SSsU,0,7258,3307,51720,155
105660524,Shana Galen,shanagalen,"animal advocate, author of fast-paced adventurous historical romances; Sign up for Shana's monthly emails: https://t.co/AHcyBhfbQa",Texas,https://pbs.twimg.com/profile_images/760548514317279233/cx-_A_1m_normal.jpg,http://t.co/MzI9HDv9va,0,7255,2821,42059,209
173170847,Harvard Humanists,HarvardHumanist,A community of humanists--atheists/agnostics/allies--dedicated 2 education & service. Our Chaplain: #GoodWithoutGod author @gregmepstein,"Cambridge, Mass",https://pbs.twimg.com/profile_images/2660332862/546ff1c715ff5e980081f68f231f289d_normal.png,http://t.co/wHFdaQiKBj,0,7255,3679,5000,211
4045291097,Paris Animaux Zoopolis,ParisZoopolis,"PAZ défend les intérêts des animaux :
🦁mettre un terme aux pratiques cruelles🐟
🐇cohabiter pacifiquement avec les animaux liminaires🐭 
 📩contact@zoopolis.fr","Paris, France",https://pbs.twimg.com/profile_images/1328722864674119680/3fvEzg90_normal.jpg,https://t.co/k0nR32KNvM,0,7253,1957,10855,54
1408662024,Daniel Mullins,DMullinsGames,Indie developer responsible for Pony Island and The Hex. Currently working on... INSCRYPTION. An inky black card-based odyssey: https://t.co/xyohrBVhRw,Vancouver BC,https://pbs.twimg.com/profile_images/476597807210438656/8QNu9VRa_normal.png,https://t.co/8jklqKg21d,0,7251,841,2005,77
2316384882,Jeff Guhin,jeffguhin,"Asst Prof @SociologyUCLA. Dad. he/él/هو.Theory, Religion, Schools, Culture, Methods. Book: https://t.co/v6fHSeG3HI",Changing a diaper,https://pbs.twimg.com/profile_images/1318324304199569409/wsnvmeIg_normal.jpg,https://t.co/kg3krwltg5,0,7248,5912,34119,101
2977588989,#INDIGNEZ-VOUS,GoLLLion,"INDIGNEZ-VOUS est l'un de ses écrits  Stéphane HESSEL : Le motif de la    résistance,c'est l'indignation.",France Fév 2015,https://pbs.twimg.com/profile_images/1349881263893700613/m7f4wPhG_normal.jpg,https://t.co/yOL8une0xw,0,7245,7053,287443,0
275772005,Liam Delaney,LiamDelaney2020,Head of LSE Department of Psychological and Behavioural Science @lse_pbs Blogposts available here https://t.co/CX4J3zdoIV,,https://pbs.twimg.com/profile_images/1288595430134120452/uFiY-K1Q_normal.jpg,,0,7234,5288,31137,277
3874714693,augustus odena,gstsdn,research scientist at google brain. saving up for a second dog. publications: https://t.co/KuGs576O0B,,https://pbs.twimg.com/profile_images/1051336114974285824/OKBkiOga_normal.jpg,https://t.co/I5jZPzl885,0,7227,1321,303,117
805213699,Olga Amargant🎗,amargant_olga,Advocada.Despatx propi després d 15 anys entre Cuatrecasas i PwC. Sóc @MoltesMerces16 @Memorial1714 @advoCATsPerCat i @juristesDDHH,I am catalan,https://pbs.twimg.com/profile_images/1295678449244413952/voHMCKTL_normal.jpg,https://t.co/CZdHfD27rh,0,7226,4501,54717,70
161106995,Natalia Galvis Arias,ngalvisarias,,"Bogotá, DC, Colombia",https://pbs.twimg.com/profile_images/1314006494673764352/XtG3LRt9_normal.jpg,,0,7226,1329,13847,21
409532265,Mona Harb,mona_harb_,"Urban Studies, Planning & Politics | Professor at the American University of Beirut & Research Lead @BeirutUrbanLab @MSFEA_AUB",Beirut & Arab region,https://pbs.twimg.com/profile_images/1209580813165174785/SCvAGksv_normal.jpg,,0,7225,2132,11176,123
131641718,Heiner Gaitán Parra,HeinerGaitan,"🌄29 | Concejal de Soacha. Colombia Humana | Politólogo Universidad Nacional |
¡#SomosLaAlternativa!

IG: https://t.co/VyqVLSTQS9

Contacto: 3142324100","Soacha, Colombia",https://pbs.twimg.com/profile_images/1324402356696584194/6kavV4zQ_normal.jpg,https://t.co/JrkMRTOcHj,0,7224,3594,12585,19
22137425,RoadPeace,RoadPeace,"Supporting people bereaved or injured by road crashes, and campaigning for justice, rights and recognition for road crash victims, and road danger reduction.",London,https://pbs.twimg.com/profile_images/968134248220823558/CbyaZL5g_normal.jpg,https://t.co/0d6OywkCEM,0,7209,1739,2896,141
41434848,Princeton Engineering,EPrinceton,Princeton University School of Engineering and Applied Science. https://t.co/xMM1OzGh4q,"Princeton, New Jersey",https://pbs.twimg.com/profile_images/2264152547/dv90iv4xkei7n75ezzup_normal.jpeg,https://t.co/ksvfaZeNHL,0,7208,1359,6043,245
2573189311,Susan🌱 🏠/😷,_SusanSams,"She/Her. Resister. Activist. Ally ➡️
✊🏾🏳️‍🌈♿♀️🐾🌱🌎☮️⚖️🌹
#HumanRights #AnimalRights #Vegan",Ohio,https://pbs.twimg.com/profile_images/929834335896612864/lvogQxS9_normal.jpg,,0,7194,7819,36945,33
93477707,EatPastry,Eat_Pastry,Makers of the original edible vegan cookie dough. Bake it or eat raw. Find us in the fridge! #nongmo #dairyfree #eggfree #glutenfree #vegan 🍪🍪🍪🍪🍪🍪,"California, USA",https://pbs.twimg.com/profile_images/1062775353087672320/gmm09GVV_normal.jpg,https://t.co/xobKnXyoLz,0,7194,6564,7021,115
28453777,Shauna,ShaunaGee,I don't at all like knowing what people say of me behind my back. It makes me far too conceited. --Oscar Wilde ☼☼☼ https://t.co/5fl7dri4v1,"California, USA",https://pbs.twimg.com/profile_images/1165511626876805120/Hzt8KH-7_normal.jpg,https://t.co/XW0j5ikqQm,0,7194,937,5015,31
17009336,Vernon Davis,VernonDavis,Seller of Engineering & Construction Services. Reader of Books. Shooter of Glocks. Collector of Old Fountain Pens — Parker Vacumatics. TSRA. NRA.,Houston,https://pbs.twimg.com/profile_images/560058037/twitterProfilePhoto_normal.jpg,,0,7190,10767,28972,112
35231986,Milo,MiloRunkle,"Founder @MercyForAnimals. Co-Founder @GoodFoodInst. Author, Speaker, Yogi & Adventure Seeker.","Los Angeles, CA",https://pbs.twimg.com/profile_images/931231289251737600/yZKUw2HC_normal.jpg,https://t.co/OeE79WhFzl,0,7187,350,2666,132
395672004,Jean-Baptiste Jeangène Vilmer,jeangene_vilmer,"Director of the Institute for Strategic Research (@IRSEM1, French MoD), nonresident Senior Fellow @AtlanticCouncil, former Policy Planning Staff (French MFA)",Paris,https://pbs.twimg.com/profile_images/1334602138484436994/99kFSGy9_normal.jpg,http://t.co/D0lkyxw2MP,0,7186,2216,3528,131
1103080440,Kindness Magazine,kindessmag,"We are your source for all things kind. Kindness to self, to other people and animals, to the planet... Love for what you do, how you do it, and life in general",Worldwide,https://pbs.twimg.com/profile_images/1274075525384826880/lLMWqidP_normal.jpg,https://t.co/hdgFfgedqa,0,7184,1587,2715,144
17965548,Joseph Cueva,josephcuevag,,,https://pbs.twimg.com/profile_images/1357084804861353987/_IIwBo2c_normal.jpg,,0,7172,3779,73173,40
299056228,Alicia Puleo,AliciaPuleo,"Filósofa ecofeminista. Catedrática de Universidad de Filosofía Moral y Política. Autora de ""Claves ecofeministas"" y de ""Ecofeminismo para otro mundo posible"".",Europa,https://pbs.twimg.com/profile_images/1217594621833949184/5YncDIJe_normal.jpg,https://t.co/89a5IA1lsE,0,7172,561,5515,117
107271287,Jane Faulkner,winematters,"Wine writer. Loves Italian vino & sherry, Burgundy & Australian wines too. All wine actually.  Journalist of 25 years. Environmentalist. Oh & feisty.","Melbourne, Australia",https://pbs.twimg.com/profile_images/378800000520871482/b6a6ce61832caa25f6d46e123d58910d_normal.jpeg,,0,7171,2980,9433,123
36016147,Lina Guisao Crespo,LINAGUISAO,"Politóloga, Magíster en Comunicación Política. Mi causa: la formación ciudadana. Aprendiz de las ciencias del comportamiento y la decisión. Empanadóloga",Medellín,https://pbs.twimg.com/profile_images/1267785588570238976/ILdE9RaU_normal.jpg,https://t.co/isMRZcT4c2,0,7168,2568,82180,115
61371244,Rick S,gratepool,Nothing matters right now except stopping the Trump Facist agenda. Say Hi for a followback #Resist #BeKind  #UniteBlue,"Columbus OH, USA",https://pbs.twimg.com/profile_images/1310407363975880706/32miIl4s_normal.jpg,,0,7168,7423,72078,160
10077242,Daniel Tenner,swombat,"Swiss, SF/F/H reader and writer, Founder of GrantTree and Woobius, Blogger @ https://t.co/QYKlq4rbFV and https://t.co/kWIvO2pMlH, Programmer, and a few other things","iPhone: 51.520279,-0.117950",https://pbs.twimg.com/profile_images/854748445285826560/hcEoctoZ_normal.jpg,https://t.co/kWIvO2pMlH,0,7163,631,38899,518
88968182,Siobhán Dowling,SiobhanDowling,Dubliner in Berlin. Editor @IPQuarterly (formerly Berlin Policy Journal). Bylines @AJENews @guardian @nytimes @Spiegel_English @HandelsblattGE @globalpost usw.,Berlin,https://pbs.twimg.com/profile_images/1266107398034423808/s_k3aDgl_normal.jpg,,0,7156,7868,35558,346
20656881,Createquity.,createquity,"The most important issues in the arts, and what we can do about them.",all over,https://pbs.twimg.com/profile_images/510894608968998912/_MRi0wf1_normal.png,http://t.co/St2kFxG2FR,0,7152,3592,7713,366
2354721992,Prof Ben Saul,profbensaul,"Challis Chair of International Law, Sydney Univ | Past Chair of Australian Studies, Harvard | Chatham House, London | Oxford DPhil",,https://pbs.twimg.com/profile_images/438221816197152768/1015I2bv_normal.jpeg,https://t.co/08TogUZpa9,0,7148,3905,8221,136
1490439596,David Edmonds,DavidEdmonds100,"Host of BBC's The Big Idea. Philosophy Bites, Philosophy 247, Oxford, Wittgenstein's Poker etc. All views are the product of my genes & the environment.",at home,https://pbs.twimg.com/profile_images/1310521759758721024/YAneFfDk_normal.jpg,https://t.co/XXIehiTqYW,0,7146,696,3358,182
198898480,AVENEWZ NEWS Australia 🇦🇺,AveNEWZ,"Australia & Singapore : An AWARD-WINNING Media , News, Broadcasting, Digital Media, Social Media, Proven Advertising Results| info@avenewz.com.au",AUSTRALIA | +61-408000830,https://pbs.twimg.com/profile_images/1170315443195637761/GaeclOMq_normal.jpg,https://t.co/3czCOQDk0y,0,7146,2097,360,0
31654309,Georgie Somerset,GeorgieSomerset,"Beef farmer, communicator, non exec director with curiosity for life & love of rural & regional",South Burnett Qld,https://pbs.twimg.com/profile_images/910228776654585856/sRedGFNt_normal.jpg,,0,7143,4108,21690,178
2330487584,OpenBooks.com,openbookscom,"#PayWhatYouWant #eBookstore & activist platform focused on making a difference. Download #eBooks, run your own #blog and take part in #free #webinars.",International,https://pbs.twimg.com/profile_images/689818612316684288/KmU7MWGN_normal.png,https://t.co/cp1JBhCb9Z,0,7143,8322,5214,212
37686305,Harriet Cross,harryvx,"British High Commissioner to Trinidad & Tobago 🇹🇹 @FCDOGovUK 🌱 Mother of cats, partner in crime of brewmaster @BrassCastlePhil, (she/her)",Trinidad and Tobago,https://pbs.twimg.com/profile_images/948561297221783553/gr5OW5uh_normal.jpg,https://t.co/qtEHf18XWj,1,7141,4450,6525,53
2258455962,Ⓥ🌱Majo Ribera🌱Ⓥ,RIBERABA,"‼⚠📷 🎥 Sensibles⚠‼ #GoVegan 🐌🐊🐀🐞🐰🐟🐝🐷🐛🐗🐮🐙🐣🐍🐴
#Veganismo
#StopEspecismo #LiberaciónAnimal // #ALF //
#Veganism
#EndSpeciesism #AnimalLiberation",España //  🇪🇸 // SPAIN,https://pbs.twimg.com/profile_images/1224079602810789889/vekIrv_H_normal.jpg,,0,7135,5969,344567,366
187484905,Hospo2,hospov2,,,https://pbs.twimg.com/profile_images/1199574014416408576/eCsc7sIR_normal.jpg,,0,7135,5692,10651,125
491711304,Allison Smith,QueensParkToday,"Founder & Publisher of Politics Today — the home of Queen's Park Today, @BCTodayOfficial and @Today_AB. Co-host of Wag the Doug, a @Canadaland podcast.",Toronto,https://pbs.twimg.com/profile_images/1040199456153632768/ABKPtx9e_normal.jpg,https://t.co/huZ2HFbr0z,0,7130,1569,8061,160
26781746,Jessica Scott-Reid,JessLReid,"Writer: animals, eco, vegan culture & food, @globeandmail @torontostar @WinnipegNews @sentient_media @TenderlyMag. Paw & Order Podcast. Former hockey wife.",Winnipeg/ Montreal/ Germany,https://pbs.twimg.com/profile_images/767350697440448512/GmR8pH94_normal.jpg,https://t.co/phXPgNWsl6,0,7128,4127,31035,126
443033172,Fistula Foundation,Fistula_Fdtn,"Fistula Foundation is focused globally on treating the childbirth injury obstetric fistula, currently funding partners in 20+ countries in Africa & Asia.","San Jose, CA",https://pbs.twimg.com/profile_images/378800000440201956/2ee96965e41e37e42e8eb8cf74ed5172_normal.png,http://t.co/uuUHC9WHmm,1,7126,1819,10746,168
730426560,Do You Believe In Dog?,DoUBelieveInDog,What began as two canine scientists being digital pen pals… now a canine science community. Tweets (mostly) by Dr Mia Cobb. Julie Hecht at @DogSpies,Wherever there are dogs,https://pbs.twimg.com/profile_images/1000528105327362049/CXzNfQNx_normal.jpg,https://t.co/NRG8izfj28,0,7120,2423,23048,178
95949373,James F. McGrath,ReligionProf,"Professor of Religion and Clarence L. Goodwin Chair in New Testament Language and Literature, Butler University",,https://pbs.twimg.com/profile_images/1099398291756851201/M5DVWEhX_normal.png,https://t.co/MflNJkOclm,0,7119,7048,78649,241
1118321,Alberto Benbunan,betobetico,Mobile & eCommerce Expert | Curious about Grocery & Retail Tech |  Venture Builder | Founder of @mobiledreams @delsuperes & @geltapp Professor @IEbusiness,,https://pbs.twimg.com/profile_images/900062239574675456/8yrCo17v_normal.jpg,https://t.co/Z1DcneXypI,1,7118,1085,11267,603
294529571,Phoebe Luckhurst,phoebeluckhurst,"Features Editor and columnist @EveningStandard | Agent: Hannah @NorthbankTalent | 📚THE LOCK IN, July 2021 @michaeljbooks @PenguinUKBooks",phoebe.luckhurst@standard.co.uk,https://pbs.twimg.com/profile_images/1342240664445190147/GKdPDne5_normal.jpg,https://t.co/itwZavA0MZ,0,7106,3890,12444,97
87855671,Ben Schneiders,benschneiders,"Investigative journalist, The Age. Reports on work, labour movement, politics and business. Contact me securely at benschneiders@protonmail.com",Melbourne,https://pbs.twimg.com/profile_images/1324874222519246849/RwGJa8B4_normal.jpg,https://t.co/aFGMIHX2MT,1,7102,2852,2688,149
243362664,Annie Hoey,hoeyannie,@Labour Senator 🌹| @together4yes sandwich board creator | @theUSI Pres 16/17 | #EndDP | dramatic feminist | #saferfromharm | owns two 🐶🐶 | sí/í | 🏳️‍⚧️ally,"Meath, Ireland",https://pbs.twimg.com/profile_images/1339328333386027009/InEZPIls_normal.jpg,https://t.co/Ml43VVYzEw,1,7098,2995,24608,96
17386718,Ellen H Ullman Ⓥ,CureT1Diabetes,MSW;Geriatric Care  Manager;Humanitarian; Vegan;GF; dedicated to a cure for type 1 diabetes;views are my own; QUINTESSENTIALLY RESOURCEFUL,,https://pbs.twimg.com/profile_images/378800000130536147/ebe89f6b18fefe800b0cb3e0baacf02c_normal.jpeg,,0,7093,7798,90363,482
8.48E+17,Aaron Sibarium,aaronsibarium,Editor @FreeBeacon. Pronouns: he/he. I am only to be referred to in the nominative case; accusatives and datives are inherently objectifying.,"Washington, DC",https://pbs.twimg.com/profile_images/1306775686187753479/i4kR2nvx_normal.jpg,,0,7089,3558,10002,72
3226037147,Pettya Popowa,BulgarianModel,"This is the official Twitter from Pettya Popowa. Bulgarian model, makeup artist and fashion stylist.",Bulgaria,https://pbs.twimg.com/profile_images/722477383991762944/wWADhgzJ_normal.jpg,https://t.co/LByna6BDni,0,7088,4835,3,79
3748882893,David Keith,DKeithClimate,Born at 319 ppm & worked climate since 351. Now focused on solar geoengineering. Teaches @Harvard. Founded Carbon Engineering. Nature Needs Half!,2/3 Canmore & 1/3 Cambridge,https://pbs.twimg.com/profile_images/646650167660310528/vpsYGGcw_normal.jpg,https://t.co/QliSeQoG0e,0,7087,146,1788,256
259312048,K.M.Pathi,kmpathi,"Educator, Speaker, Author | Ethics | #values “While we teach, we learn” Seneca","New Delhi, India",https://pbs.twimg.com/profile_images/1292848629594460160/0p1QreiJ_normal.jpg,,0,7087,164,457,1
141955271,Oscar's Law,OscarsLaw,End the factory farming of companion animals. Ban the sale of animals from pet shops Promote rescue groups and shelters. #AbolishPuppyFactories,Australia,https://pbs.twimg.com/profile_images/953251686214115328/oICcfBm6_normal.jpg,https://t.co/baO9w1B1HI,0,7083,582,9706,82
