id,name,username,description,location,profile_image_url,url,verified,followers_count,following_count,tweet_count,listed_count
14372270,melissa “cancel student debt” byrne,mcbyrne,always fighting for someone i don’t know. alum @berniesanders’16’20. banned from trump https://t.co/wAWoEA9Jpx college.#cancelstudentdebt,"philly. (and dc, nyc, and ca)",https://pbs.twimg.com/profile_images/640377859819859968/nZVTJnT3_normal.jpg,,1,27441,11757,133233,317
14217173,Robert A.F. Thurman 🌏,BobThurman,"Official Account of Author, Co-Founder of @TibetHouseUS + @Menla Retreat and Dewa Spa with @nenathurman, father, grandfather, student of Tibet & @DalaiLama.","NYC & Woodstock, NY",https://pbs.twimg.com/profile_images/533359888093569024/kMmM9lpP_normal.jpeg,http://t.co/p0heIZcQGk,0,27415,5608,24348,678
19694637,Dr Alexandra Phelan,alexandraphelan,"Asst Professor @Georgetown_GHSS | Adj Prof @GeorgetownLaw | Pandemics, Infectious Disease, International Law, Planetary Health, Human Rights 余雪莲 She/Her 🏳️‍🌈",Australian in DC & NYC,https://pbs.twimg.com/profile_images/1250761435019345920/WBvTSlyj_normal.jpg,https://t.co/6WmdZXEE0L,1,27394,4371,19356,1456
176690037,Wendy Zukerman,wendyzuk,"Wendy Zukerman is a science journalist and EP/host of @sciencevs, a Gimlet Media podcast. Season 10 (!) out in March 2021.",New York,https://pbs.twimg.com/profile_images/1080087801901633536/elMFubnp_normal.jpg,https://t.co/rrczsZCoPU,1,27375,939,5888,446
17296689,RSPCA Australia,RSPCA,"Our mission is to prevent cruelty to animals by actively promoting their care and protection.
https://t.co/xLWCKzMk5X","Canberra, Australia",https://pbs.twimg.com/profile_images/917960614185709569/mRfLE6AQ_normal.jpg,http://t.co/k19hB4HIWh,1,27373,3898,5814,411
25827743,Steven Spencer,sspencer_smb,"prop trader in nyc. focus is intra-day&swing. 
2014 will start to position trade...one of the  least angry people on Twitter finance... $NKLA $HTZ",nyc,https://pbs.twimg.com/profile_images/897435372044648449/2v0EJLku_normal.jpg,https://t.co/1SZRMyOSt0,0,27349,1630,97307,1024
182758455,Pixel,Beats4Pros,visit my site: https://t.co/PAQPtzqfQ4 tomaszkselib@gmail.com,Poland,https://pbs.twimg.com/profile_images/960901281232584704/ojs2gu4d_normal.jpg,https://t.co/HGCfYcyssI,0,27340,42719,68026,107
23408887,Global Institute of Sustainability and Innovation,ASUgreen,News and events from Arizona State University's Global Institute of Sustainability and Innovation.,"Tempe, AZ",https://pbs.twimg.com/profile_images/1293608198788677633/d9WtSIEB_normal.jpg,http://t.co/lqoYUIhSWB,0,27301,12087,12580,1142
107279177,Maria Antonia,Fulania,Hormonalmente alterada.,"Bogotá, D.C., Colombia",https://pbs.twimg.com/profile_images/1304274953207001094/KTkYeHTT_normal.jpg,https://t.co/SsIsZ12jec,0,27291,347,1134,167
363005534,William MacAskill,willmacaskill,"Assoc Prof of Philosophy, Global Priorities Institute, Oxford U. Author of Doing Good Better & Moral Uncertainty; promoter of effective altruism & longtermism.",Oxford,https://pbs.twimg.com/profile_images/1305122336241221633/fTk0TWRB_normal.jpg,http://t.co/Db3VE8qSyV,0,27276,1174,325,0
1467788298,Murat Önderman,muratonderman,"Dereceli profesyonel öğrenci, amatör sokak fotoğrafçısı ve müziksever. Academician, amateur #streetphotographer & music lover 🎶🎵📷",İstanbul Üniv. Öğretim Üyesi,https://pbs.twimg.com/profile_images/1324728973641867266/FEENQauX_normal.jpg,,0,27272,10469,65694,103
374726395,Alex ((Space Laser)) Wellerstein,wellerstein,"Professor of History of Science/STS at @FollowStevens. Author: RESTRICTED DATA: The History of Nuclear Secrecy in the USA (U. Chicago, 2021). Maker of NUKEMAP.","Hoboken, NJ / NYC adjacent",https://pbs.twimg.com/profile_images/1347299885960327168/e-NSoZJv_normal.jpg,https://t.co/Xkq2Fhqq72,1,27260,1026,14684,692
3287916110,Bernie's Homie,BerniesHomie,I tweet pictures of food for the NSA archives. Makeshift Patriot   🇺🇸 Lisa Simpson Liberal 🇺🇸 #FeelTheBern #AOCisforme #GreenNewDeal #Medicare4All,,https://pbs.twimg.com/profile_images/623961120345174017/ebIe0HiL_normal.jpg,http://t.co/7zE08e6YhU,0,27256,29982,66190,252
15923700,Better World Books,BWBooks,Online bookstore that's raised $26 Mil. for literacy. Each time you buy a book we donate one to someone in need.,Everywhere.,https://pbs.twimg.com/profile_images/1241073774595842049/crkFsMMF_normal.png,https://t.co/M1DPGKVSLG,1,27253,16216,13717,0
80955497,Ally Hinton,AllyHinton,💻📱Digital Marketing nomad. 🌎🏕 Remote entrepreneur. 🏳️‍🌈🤓🎮 Nerd extraordinaire. 📸Photographing & 🎬 Filming all the things.🐾🌱I don’t eat anything that 💩,Florida | USA | International,https://pbs.twimg.com/profile_images/1053455507887927296/0mOVPALK_normal.jpg,,0,27242,1851,7224,81
350362817,Jonathan Nicholas,JonathanNichol4,"UK cop 30yrs, Book Guild author of ‘Who'd be a copper?’ & ‘Kittyhawk Down’ https://t.co/UMaVJcj8KN","Nottingham, UK & elsewhere.",https://pbs.twimg.com/profile_images/1012030644107530240/WKg7vQqU_normal.jpg,https://t.co/cgDIBiTDDZ,0,27212,38867,92750,334
126226388,Jay Kreps,jaykreps,CEO of @confluentinc (https://t.co/RHpq5oBimL). Co-creator of @apachekafka. Sí se puede.,"Mountain View, California",https://pbs.twimg.com/profile_images/1123808410510737408/NCWzmizz_normal.png,https://t.co/RYAhBXdswh,0,27185,687,7139,801
19019494,Dr Jenna Price,JennaPrice,"Journalist. Columnist. @smh @canberratimes Academic. Grandmother of dragons. PhD, political sociology thanks to @ariadnevromen E: jennapricejournalist@gmail.com",Sydney,https://pbs.twimg.com/profile_images/549718024987500544/gvosD6vD_normal.jpeg,https://t.co/0v78zO8w65,1,27170,5898,121017,564
966562123,Modern Stoicism,StoicWeek,Modern Stoicism is a nonprofit organization applying Stoic philosophy to modern living.,International,https://pbs.twimg.com/profile_images/869878342685687808/b0CiSkhi_normal.jpg,https://t.co/3EoDZnebCF,0,27165,1163,4645,0
34888595,Rupert Read 🌍,GreenRupertRead,"Public intellectual based at @uniofeastanglia. Newest book: ’Parents for a future’, out January 2021. Personal tweets: @rupertread",Norwich,https://pbs.twimg.com/profile_images/1308390637981626368/PEI5HRfR_normal.jpg,https://t.co/QCgvY8TOST,0,27106,955,48420,494
36074231,Matt Bevan 🎙,MatthewBevan,"Host and writer of ‘America, If You’re Listening’ from @abcnews, @RNBreakfast reporter.","Newcastle, New South Wales",https://pbs.twimg.com/profile_images/1305478511486889985/R2BYy2Aj_normal.jpg,https://t.co/zByOvZWXcS,1,27092,2770,62981,297
35693823,sarasdewi,sarasdewi,"I'm a philosophy lecturer at Universitas Indonesia. Sentimental Balinese, LFC zealot, mother to Pomeranians, fat vegan, “Deus sive Natura”",,https://pbs.twimg.com/profile_images/1322303742604013568/3idyU44I_normal.jpg,https://t.co/8SnqdEOIdJ,0,27079,701,44670,76
36123433,Blackwell's,blackwellbooks,"Bookseller to the world!
Have any questions about your order? 📦
Send us a DM📩 with your order number.
https://t.co/4UHvfORX8r
https://t.co/NYbEOX7k5v",,https://pbs.twimg.com/profile_images/1027885886279692289/5XU8Z6s6_normal.jpg,https://t.co/HQHcNz8wEq,1,27032,5154,14831,553
464854839,Rachel Donadio,RachelDonadio,Writer | Contrib. Writer @TheAtlantic *🇫🇷 | Ex-@nytimes Rome Buro Chief; 🇪🇺 culture corro. | in a 🌍 of “!!” I prefer the “;” | rachel@racheldonadio.com,,https://pbs.twimg.com/profile_images/911921382610620417/-zgjuLE7_normal.jpg,,1,27025,2181,11800,918
16821997,Michelle Desilets🦧,orangutans,Founder of Orangutan Land Trust and Borneo Orangutan Survival UK. Saving orangutans for 25+ years. Forests. For Orangutans. Forever.  http://t.co/Uc7RQ4TLVE,United Kingdom,https://pbs.twimg.com/profile_images/946713001847123968/sKWlvzto_normal.jpg,http://t.co/g68inwCzIy,0,26973,29631,36994,1180
468657693,Christian Vanderbrouk,UrbanAchievr,"@43ForAmerica, @RVAT2020, @bulwarkonline",out of my element,https://pbs.twimg.com/profile_images/1224358888922808321/3yOFIDv8_normal.jpg,https://t.co/D1N19GEk4V,0,26924,4872,83474,433
2695392493,Joanna Rutkowska,rootkovska,Long-term navigation @ https://t.co/ccNLma35RB & architect of @wildlandio. Previously @QubesOS & ITL founder. Distrusts computers. Freedom over safetyism.,Warsaw,https://pbs.twimg.com/profile_images/1002520385156509697/PhUHrM3y_normal.jpg,https://t.co/M1Oty4CtZm,1,26913,133,5761,651
9.61E+17,Veganella 🥦,Veganella_,It takes nothing away from a human to be kind to an animal 🌱✌🏼🌍 Considering veganism? Use my Veganuary sign-up link below ⤵️ She/her 😊,,https://pbs.twimg.com/profile_images/1324645573803319298/YoNNArsQ_normal.jpg,https://t.co/7rVSJWaeqJ,0,26727,17587,148386,139
117345550,Denis Colombi,Uneheuredepeine,Sociologie de l'actualité et actualité de la sociologie | Sociology of today and today's sociology. Où va l'argent des pauvres en librairie chez @Editionspayot,Likes/RT != adhésion,https://pbs.twimg.com/profile_images/712540562348449792/D7WMaMf3_normal.jpg,https://t.co/F80Tm1PPt4,0,26552,3526,118935,336
76643486,Leo Margets,LeoMargets,Poker player @winamax - Podcaster @bio_solver ♠️ Writer ♥️ Be water ♣️ Be curious ♦️ Contact: leo@leomargets.com,Around the globe!,https://pbs.twimg.com/profile_images/1296452435054153730/r5DQgIPJ_normal.jpg,https://t.co/e3kzHxlTZ1,1,26542,475,14976,426
3760488922,Dr Julia Shaw,drjuliashaw,"""Interesting ethical conversations...I can almost hear Shaw’s eyeroll"". Psyc science @ucl, podcast @bbcsounds & recently back-to-school @QueerHistGold. #BiinSci","London, England",https://pbs.twimg.com/profile_images/1350013151870414849/-Uh1v4gp_normal.jpg,https://t.co/tJD53J2f58,1,26500,2167,7771,376
78702900,Jesse Norman,Jesse_Norman,"Financial Secretary at HM Treasury/tax and infrastructure strategy, Hereford & S Hfds MP, campaigner, author of bios of Burke & Adam Smith: https://t.co/rhUUrHWAed",Hereford,https://pbs.twimg.com/profile_images/873167744140795904/IkmunJuX_normal.jpg,https://t.co/ptCPSSo1P4,1,26493,1804,13555,676
187966792,Valarie Kaur,valariekaur,"Civil Rights Lawyer, Mother, Sikh Woman Warrior. Creator of #PeoplesInauguration. My book #SEENOSTRANGER: https://t.co/wgqHbMRU45","Los Angeles, CA",https://pbs.twimg.com/profile_images/1314122527803809793/dn5ihOZT_normal.jpg,https://t.co/VK1z7ST676,0,26377,988,14223,432
36733306,Paul Gorski - Equity Literacy Institute ✊🏻,pgorski,"Author, activist, educator, founder of Equity Literacy Institute. Personal web site at https://t.co/908xvXvpiq.","Asheville, NC",https://pbs.twimg.com/profile_images/1213244959328915458/QmQkjWxX_normal.jpg,https://t.co/s1Kxe5W5su,0,26339,1188,3292,197
14294400,Tim Watts MP,TimWattsMP,"Labor Member for Gellibrand, Shadow Asst Minister for Communications & Cybersecurity. Authorised: Tim Watts, 97 Geelong Rd, #Footscray.","Footscray, Melbourne",https://pbs.twimg.com/profile_images/1335753183671406595/twvtTE5Y_normal.jpg,https://t.co/umpxrtmU35,1,26320,7562,43776,385
159146922,Philip Lymbery,philip_ciwf,"Animal advocate, author. Global CEO: Compassion in World Farming, Visiting Professor Winchester, President: Eurogroup for Animals
Books Farmageddon, Dead Zone.","CIWF International, offices in 12 countries, inc UK, USA, Brussels & China.",https://pbs.twimg.com/profile_images/1045583316781600768/h0GcOyli_normal.jpg,https://t.co/mwKepQ1FuQ,0,26273,3070,21475,496
39364992,Richard Susskind,richardsusskind,"Co-author with @DanielSusskind of 'The Future of the Professions'; President, Society for Computers & Law; IT Adviser to Lord Chief Justice; speaker; professor.","Hertfordshire, England",https://pbs.twimg.com/profile_images/1176550062106783746/PCBdyCQm_normal.jpg,http://t.co/DqiUVlCayO,0,26233,1469,2510,671
54151280,foodwatch NL,foodwatch_nl,"foodwatch is een onafhankelijke voedselwaakhond. Samen met consumenten zoals jij zetten we ons in voor eerlijk, veilig en gezond eten. Doe je mee?",Nederland,https://pbs.twimg.com/profile_images/488967388159684608/qtDnODcf_normal.jpeg,https://t.co/gBeZx3i61Y,0,26223,1446,7976,376
146344454,emma lahana,emmaklahana,Instagram: emmakatelahana,,https://pbs.twimg.com/profile_images/761340007231528960/H6nBP8V9_normal.jpg,,1,26220,518,3899,282
185589059,PeriodismoCientífico,comunicaCiencia,"#ciencia, #educación, #divulgación, #comunicaciencia",Spain,https://pbs.twimg.com/profile_images/3613962057/846bedb5c80f26e29e54b0f92db5aa2d_normal.jpeg,https://t.co/9h14TyTdsC,0,26146,2329,2745,193
1349634162,HSD,homestyledir,"Platform for lifestyle, art, pop culture, interiors, animals & Blogger, Business & Creatives arm. Always seeking high quality additions. https://t.co/ZD7cul2h9F",,https://pbs.twimg.com/profile_images/378800000103547018/f4ada69994b9cd4bbedc5ccd89a0385f_normal.jpeg,http://t.co/OXKihz7Rh1,0,26112,10375,6906,32
42696696,André Forastieri,forastieri,Assine minhas newsletters HOMEWORK (https://t.co/xx3JasqHd6) e FORASTA NEWS (https://t.co/LJBde6JrQM). Não te arrependerás!,São Paulo,https://pbs.twimg.com/profile_images/1021848825038876673/AeM15COb_normal.jpg,https://t.co/LG6bTV9vlf,0,26083,1204,88953,503
62933037,Daud Osman,daudedosman,"Stock/option trader, policy analyst, anticorruption activist, researcher on innovations & best practices. Retweets aren't endorsement. 🇸🇴 🇺🇸 🇨🇦",Minnesota USA,https://pbs.twimg.com/profile_images/872117454499192832/iSxDt1gJ_normal.jpg,https://t.co/WckpjJaJIT,0,26076,1770,7791,38
168637711,Gastronomía Vegana,GastronomiaVeg,"Blog de gastronomía vegana, ¡no solo recetas! 👩‍🍳
📣 Libro: Cocina Vegana, Ed. Anaya, con información nutricional de @dimequecomes. A la venta en librerías 📚",España,https://pbs.twimg.com/profile_images/873519878568914945/IilYs0Gn_normal.jpg,http://t.co/yCLasniAq4,0,26037,332,3879,276
66804635,anthropologyworks,anthroworks,"Cultural anthropologist Barbara Miller offers you updates on what is important and relevant about people, culture, change, and policy around the world","Washington, D.C.",https://pbs.twimg.com/profile_images/707641490688839684/ZoWNLhYb_normal.jpg,https://t.co/yuAkK2eJuq,0,26019,21712,29054,733
222210727,José González,_JoseGonzalez_,I play guitar and sing. Excited about #EffectiveAltruism #EcoModernism #SecularHumanism • Find my music here: https://t.co/eboQLkTrkD,"Göteborg, Sverige",https://pbs.twimg.com/profile_images/646681702119575552/g9nEpG3W_normal.jpg,https://t.co/eboQLkTrkD,1,25953,1105,4505,458
72424982,Elif Ince,Elifince,"Gazeteci / Journalist covering Turkey. @ColumbiaJourn, @BrownUniversity + daily Radikal alum 🌈",Istanbul,https://pbs.twimg.com/profile_images/1756649048/182000_665296308711_1006315_36529690_7438900_n_normal.jpg,,0,25910,4911,6752,206
59393374,Text Publishing,text_publishing,A publisher of literary fiction and non-fiction. Three-time ABIAs Small Publisher of the Year; 2018 Leading Edge Books Small Publisher of the Year.,"Melbourne, Australia",https://pbs.twimg.com/profile_images/1345878082943549440/X-j1Pm41_normal.jpg,http://t.co/VMxygUMFiX,0,25897,5212,39878,646
31766093,Gene Baur,genebaur,"Gene Baur is a #vegan activist, best selling author, and co‑founder and president of @FarmSanctuary, America’s leading farm animal protection organization.",,https://pbs.twimg.com/profile_images/688079082433548288/TJLCmSkK_normal.jpg,http://t.co/I1f89ujTDL,0,25877,2625,33091,581
106203986,monica s,monicasanhueza,"Periodista, ex conductora de noticias y programas en CHV y UCV. Coach, Master en Coaching y Liderazgo U. de Barcelona. Socia Natus https://t.co/vopncm6zDs",,https://pbs.twimg.com/profile_images/603619020319936512/DEmwDKGJ_normal.jpg,,0,25877,4150,12047,269
49044100,Linda Scott,ProfLindaScott,"Author; Founder #DoubleXEconomy, @PowerShiftForum & Global Business Coalition for #WomensEconomicEmpowerment; Emeritus Professor, University of Oxford","Rhode Island, USA",https://pbs.twimg.com/profile_images/1278707799015505922/2vHa7jU9_normal.jpg,https://t.co/R0oSJHUwzL,0,25849,46802,30510,877
25796143,Mary Hui,maryhui,"Reporter @qz covering geopolitics/tech/business in Asia, & Hong Kong. Previously: freelancer & @washingtonpost. Trail runner. mhui@qz.com",Hong Kong,https://pbs.twimg.com/profile_images/1030738762060292096/hqQC2y8T_normal.jpg,https://t.co/1toXjV4v4T,1,25844,1619,9940,570
30203415,Comma Press,commapress,Indie publisher of short fiction from the UK & beyond. Small Press of the Year North regional winner. Buy direct https://t.co/cEYepY46h2 Email info(at)https://t.co/cEYepY46h2,"Manchester, UK",https://pbs.twimg.com/profile_images/1347176543378944005/NAmkfiUa_normal.png,https://t.co/cEYepYlH8A,0,25765,13738,42044,537
16028750,Greg Toppo,gtoppo,"Journalist, @NUQatar j-school prof, author of THE GAME BELIEVES IN YOU: How Digital Play Can Make Our Kids Smarter @gamebelieves gregtoppo1@gmail.com Open DMs.","Maryland, USA",https://pbs.twimg.com/profile_images/1142495708517412870/bfyLAdpR_normal.png,https://t.co/qp0BJ35AXo,1,25667,17792,17981,1288
2777109560,Megan Rochell,Megan_Rochell,Megan Rochell music video subscribe here https://t.co/U8PySb6Mcq,"Atlanta, GA",https://pbs.twimg.com/profile_images/1298269891217076228/ROoNHqRr_normal.jpg,https://t.co/U8PySb6Mcq,0,25649,16794,2239,19
32377320,Solar Sister,Solar_Sister,Light. Hope. Opportunity. Women's enterprise spreading clean energy in Africa. #BeTheLight 2020 Matching Gift Challenge ✨💫💃🏾,"Tanzania, Nigeria",https://pbs.twimg.com/profile_images/904396183396896768/Qi9POe2g_normal.jpg,https://t.co/7NeN8eekB5,0,25648,7908,27400,1319
38676402,Universidad Icesi,icesi,Primera Universidad privada del Suroccidente Colombiano con Acreditación Institucional de Alta Calidad.,Cali - Colombia,https://pbs.twimg.com/profile_images/1320016835933241345/JQMmxq3A_normal.jpg,http://t.co/drMXEr7O5O,0,25633,4498,8099,303
30432438,gracewatkins,gracewatkins,"Gaming, creators, social media. Founder/CEO @click_mgmt / @theclickcrew & talking internet & gaming on @watchtimepod.","Melbourne, Victoria",https://pbs.twimg.com/profile_images/1159431888848789505/j3ayCM7m_normal.jpg,https://t.co/tNVUcGE0GG,1,25588,546,2628,14
37141924,Kyriakos Pierrakakis,Pierrakakis,"Minister of Digital Governance, Hellenic Republic","Athens, Greece",https://pbs.twimg.com/profile_images/1152881773380026369/M1sTlGsL_normal.jpg,https://t.co/72H3woPCsr,1,25512,1887,9191,201
43944739,"Vanessa Neumann, Ph.D.",vanessaneumann,"Venezolana luchadora por un verdadero cambio democrático en mi país natal donde dejé mi corazón | Emprendedora @Asymmetrica_, ex-diplomática | @Yale y @Columbia","Caracas, Nueva York, y Londres",https://pbs.twimg.com/profile_images/1349502342215983106/vJIodwIg_normal.jpg,https://t.co/gXkUqdeO9j,1,25474,5172,19497,230
198265624,Lawctopus,Lawctopus,India's leading online portal for students of law! Our online law school is at https://t.co/3h9ZltJwke,India,https://pbs.twimg.com/profile_images/1324324289080819712/4NfXQnQ-_normal.jpg,http://t.co/wsk2cWPRdl,0,25344,883,20414,65
445822246,francesco pizzetti,francopizzetti,Professore ordinario di diritto costituzionale a Torino e docente alla LUISS.  Presidente  autorita' protezione dati personali da 18 aprile 2005 a 17 giugno2012,,https://pbs.twimg.com/profile_images/378800000767598775/51406203f3a6a6cd59958dc745d0f1b6_normal.jpeg,,0,25296,22346,75479,234
37104983,Dan Saltzstein,dansaltzstein,"Deputy Editor, Special Sections at @nytimes. Former: editor at @nytimestravel. Ruthless Cosmopolitan.","Woodside, NY",https://pbs.twimg.com/profile_images/191752101/icon_normal.jpg,https://t.co/UmqCI5RSM5,1,25296,2777,49835,743
140317619,Tim Costello,TimCostello,"Director of Ethical Voice, Exec Director of Micah Australia, Senior Fellow for Centre for Public Christianity, Advocate for pokies reform tc@timcostello.org","Melbourne, Victoria",https://pbs.twimg.com/profile_images/1034004485528383488/WX0AwLt5_normal.jpg,,1,25235,493,2321,303
72851410,Vincent Cespedes,VincentCespedes,"Logovore | 📘 « #LeMondeEstFlou. L’avenir des intelligences » 📆 @EditionsPlon, 11 février 2021",Paris,https://pbs.twimg.com/profile_images/1289273441787551746/Kz_j_GIG_normal.jpg,https://t.co/O77uCIydDt,0,25185,27655,33019,317
19491239,Naomi Smith 🇬🇧🇪🇺🏳️‍🌈🏳️‍⚧️,pimlicat,"Chief Exec @bestforbritain, co-host @ohgodwhatnowpod & @bunker_pod, cross-party activist, internationalist, xenophile, humanist, vegan, FCMA/CGMA",Citizen of Everywhere,https://pbs.twimg.com/profile_images/1154046873616801798/F3SoS4cx_normal.jpg,https://t.co/B8UVpJoN92,0,25174,4956,47980,297
1140123648,APA,apaphilosophy,"American Philosophical Association, the premier philosophical learned society in North America.",University of Delaware,https://pbs.twimg.com/profile_images/3767384980/73b8be36dbf666ce59b291d6b16dec99_normal.png,http://t.co/QDg8pohZ5N,0,25150,449,5973,385
23321855,Colleen Patrick-Goudreau,JoyfulVegan,"Author of 'The 30-Day Vegan Challenge,' 'The Joy of Vegan Baking,' 'The Joyful Vegan,' + 4 more. https://t.co/FJwaD4XJpU Host of 'Food for Thought' Podcast. 🥰","Oakland, CA",https://pbs.twimg.com/profile_images/829083575282700293/xRQqSkmN_normal.jpg,https://t.co/gdDs0Bbq8s,1,25032,3970,22751,725
146548246,Ken Caldeira,KenCaldeira,"Senior scientist(@Breakthrough) researching issues related to climate, carbon and energy. (Also, @CarnegieScience, emeritus). First draft of personal views.","Stanford, CA",https://pbs.twimg.com/profile_images/831321970943815680/JifD0vHE_normal.jpg,https://t.co/Ugx9Pm22ZH,0,24990,4515,13381,888
2155987393,Mike Nayna,MikeNayna,Filmmaker. Fond of the politically neutral. YouTube - https://t.co/RG7RTFXsMi - Instagram - https://t.co/eeQ9XN5N4A - redesigning social media at - https://t.co/tyAQ6BDcif .,"Melbourne, Victoria",https://pbs.twimg.com/profile_images/1145577660564697088/LchxlBQY_normal.png,https://t.co/MX4aBXRc6J,0,24804,613,1877,155
41120320,Museum of Food+Drink,mofad,"African American: Making the Nation’s Table is our upcoming exhibit 🌍
#foodisculture","Brooklyn, NY",https://pbs.twimg.com/profile_images/467396307217162242/NsWGTOAh_normal.png,https://t.co/Gkr0o8RyCK,0,24795,966,11178,370
8.51E+17,Philippe Lemoine,phl43,"I'm a PhD candidate in philosophy at Cornell, but I live in Paris now. I also have a blog where I write about stuff. ""At least he's pretty smart."" (@bechhof)","Paris, France",https://pbs.twimg.com/profile_images/1246053633847750662/YxBXI9U9_normal.jpg,https://t.co/7cQiLumSvk,0,24791,1231,71192,309
14670741,Aust Writers Centre,WritersCentreAU,The Australian Writers' Centre helps you get published and write with confidence. Start your writing journey here! http://t.co/0DocZMw9qs,Classroom and Online courses,https://pbs.twimg.com/profile_images/438456377699094530/V1BiHuGG_normal.jpeg,http://t.co/asipwpC5MP,0,24729,14409,73313,627
2926961752,Haytap,HaytapOfficial,Haytap Hayvan Hakları Federasyonu / The Animal Rights Federation in Turkey #Haytap,,https://pbs.twimg.com/profile_images/1031609936210522113/3AumfqGY_normal.jpg,https://t.co/AlEzvaJVsp,0,24653,262,10675,42
72103,Oli Barrett,OliBarrett,I'm trying to make life-changing introductions. Co-founder @TOTScampaign @TennerFiverYE @VIYproject @CleanandCool https://t.co/vti5ZafiUG,United Kingdom,https://pbs.twimg.com/profile_images/1290206127607734272/b2SQEN8d_normal.jpg,https://t.co/3UeJGtWFVB,0,24607,18828,28127,656
83366359,Wild Futures,wildfutures,"Dedicated to the protection of primates, Wild Futures campaigns to end the primate pet trade. The Monkey Sanctuary is our flagship project. Reg Charity:1102532","Cornwall, UK",https://pbs.twimg.com/profile_images/1163843034112565249/GKmU3BF3_normal.jpg,http://t.co/GwyUkwYRGY,0,24591,25433,41528,339
222759609,VegfestUK,VegfestUK,"Welcome to VegfestUK, with some of the biggest #vegan #festivals in the UK. Our events have moved Online during the Covid 19 Crises",Online,https://pbs.twimg.com/profile_images/926584344730390528/iroIrIE3_normal.jpg,https://t.co/OzhZsLOimS,0,24564,3293,29187,402
32628749,Louise Story,louisestory,Chief Product & Technology Officer & Chief News Strategist @WSJ Masthead editor. Investigative reporter who 3x uncovered massive frauds.Filmmaker. Alum @NYTIMES,New York City,https://pbs.twimg.com/profile_images/960538211515863040/ZOFpfaRj_normal.jpg,,1,24557,2414,4672,1000
118917461,Ryan Shea,ryaneshea,"Co-founder of @Stacks. Builder of @Citizenbase. Working on something new. Background in comp sci, mech eng, bio & design.","New York, NY",https://pbs.twimg.com/profile_images/1308971197376454656/qUeh4_bX_normal.jpg,https://t.co/oKzRDeWKoy,0,24541,1681,7371,1044
248568868,"Dr. Peter A Singer, OC",PeterASinger,Special Advisor to @DrTedros @WHO. Co-founder @gchallenges 🇨🇦 & @utjcb. My views. Bio: https://t.co/eHRBzqxe5U,Geneva,https://pbs.twimg.com/profile_images/1280840653568643078/ioyswHQK_normal.jpg,https://t.co/wVulKuROWG,1,24497,9444,58217,706
22092333,ABC Religion&Ethics,ABCReligion,"Religion and ethics news, opinion and programs from the ABC.",Australia,https://pbs.twimg.com/profile_images/1039774503348256768/br3N21UM_normal.jpg,http://t.co/fXo4ZyqsDh,0,24420,1980,29835,684
180817439,Mårten Schultz,martenschultz,In your rearview mirror is the motherfucking law.,Stockholm.,https://pbs.twimg.com/profile_images/1109230848/viljanstriumf_normal.jpg,https://t.co/HQzIATp7TB,0,24418,3583,105835,153
200886739,Roxana Kreimer,RoxanaKreimer,"Lic en Filosofía y Dra Ccias Sociales  
Youtube: https://t.co/xg5htsNxDR
Patreon: https://t.co/vgBlfBP359
@feminisciencia y @feminiscience",Buenos Aires,https://pbs.twimg.com/profile_images/1124138494140588032/-gsdGkni_normal.png,https://t.co/JLRhlmqrJ4,0,24367,1105,10575,116
297061383,Martine Croxall,MartineBBC,"BBC News Presenter, host of The Papers Mon-Fri 10.40 & 11.30pm, Sat & Sun 10.30 & 11.30pm.",London www.bbc.co.uk/news,https://pbs.twimg.com/profile_images/1048295070057865216/gJQpdkNi_normal.jpg,https://t.co/xEbkU9klus,1,24339,3279,23712,295
